canonical_label,frequency,n_participants,group_coverage
Reading LLM response aloud,42,5,E:17 / B:25
Performing calculation,19,5,E:12 / B:7
Reading task statement aloud,13,4,E:5 / B:8
Paraphrasing LLM's response,12,1,E:12 / B:0
Deciding to consult LLM,8,6,E:6 / B:2
Expressing uncertainty,8,5,E:6 / B:2
Reading LLM's follow-up question,8,1,E:8 / B:0
Restating problem question,7,2,E:7 / B:0
Restating task question,7,3,E:4 / B:3
Expressing confusion,6,3,E:3 / B:3
Formulating question for LLM,6,3,E:5 / B:1
Reading LLM's CoT aloud,6,1,E:6 / B:0
Restating given information,6,5,E:5 / B:1
Expressing frustration,5,4,E:3 / B:2
Expressing self-doubt,5,4,E:4 / B:1
Formulating clarifying question for LLM,5,4,E:4 / B:1
Identifying given information,5,2,E:2 / B:3
Re-reading LLM's question,5,1,E:5 / B:0
Applying Pythagorean theorem,4,4,E:2 / B:2
Committing to answer,4,3,E:1 / B:3
Formulating LLM query,4,1,E:4 / B:0
Identifying task goal,4,2,E:1 / B:3
Orienting to task figure,4,2,E:1 / B:3
Recalling Pythagorean theorem,4,4,E:2 / B:2
Recording given value,4,1,E:4 / B:0
Requesting method from LLM,4,1,E:4 / B:0
Restating Given Values,4,2,E:1 / B:3
Setting up equation,4,3,E:4 / B:0
restating task definition,4,1,E:0 / B:4
Announcing task reading,3,2,E:0 / B:3
Calculating half-diagonal length,3,1,E:0 / B:3
Confirming final answer,3,3,E:2 / B:1
Deciding to redo calculation,3,2,E:3 / B:0
Describing given figure,3,1,E:3 / B:0
Finalizing answer,3,2,E:1 / B:2
Identifying calculation error,3,2,E:3 / B:0
Marking action completion,3,1,E:0 / B:3
Reading task question aloud,3,2,E:2 / B:1
Recognizing calculation error,3,2,E:1 / B:2
Requesting confirmation from LLM,3,2,E:3 / B:0
Requesting formula from LLM,3,3,E:3 / B:0
Restating problem information,3,1,E:3 / B:0
Signaling cognitive pause,3,1,E:3 / B:0
Stating given information to LLM,3,1,E:3 / B:0
Stating goal to LLM,3,1,E:3 / B:0
placing point on diagram,3,1,E:0 / B:3
"reading lost response aloud (garbled, partial)",3,1,E:0 / B:3
Acknowledging own oversight,2,2,E:1 / B:1
Answering LLM in the negative,2,1,E:2 / B:0
Applying method to own values,2,1,E:2 / B:0
Appraising task difficulty,2,1,E:2 / B:0
Computing half-diagonal values,2,2,E:1 / B:1
Computing squared value,2,2,E:0 / B:2
Confirming answer matches options,2,1,E:2 / B:0
Confirming formula from response,2,2,E:1 / B:1
Constructing auxiliary triangle,2,2,E:2 / B:0
Continuing calculation,2,2,E:2 / B:0
Correcting LLM's assumption,2,2,E:1 / B:1
Deciding to ask LLM for clarification,2,1,E:2 / B:0
Deciding to correct LLM's assumption,2,2,E:2 / B:0
Deciding to inspect LLM's CoT,2,1,E:2 / B:0
Deciding to sketch diagram,2,2,E:1 / B:1
Deciding to verify calculation with LLM,2,1,E:2 / B:0
Deciding to verify recalled formula with LLM,2,1,E:2 / B:0
Deriving circumference formula,2,1,E:2 / B:0
Deriving half-chord length,2,2,E:1 / B:1
Deriving simplified equation,2,1,E:2 / B:0
Dictating formula for message,2,2,E:2 / B:0
Dictating given values for LLM,2,1,E:2 / B:0
Dictating question to LLM while typing,2,2,E:1 / B:1
Evaluating plausibility of result,2,2,E:2 / B:0
Externalizing information via note-taking,2,1,E:2 / B:0
Extracting given information,2,2,E:1 / B:1
Extracting given value,2,1,E:2 / B:0
Formulating equation,2,2,E:2 / B:0
Identifying missing information,2,2,E:2 / B:0
Identifying target value,2,1,E:2 / B:0
Initiating task reading,2,2,E:1 / B:1
Mapping given value onto triangle side,2,1,E:2 / B:0
Mapping known value to diagram,2,1,E:2 / B:0
Orienting to new task,2,1,E:2 / B:0
Performing Pythagorean calculation,2,2,E:1 / B:1
Performing division calculation,2,2,E:1 / B:1
Planning next calculation step,2,2,E:1 / B:1
Re-reading Task Statement for Comprehension,2,1,E:0 / B:2
Re-reading Task Statement to Recall Question,2,1,E:0 / B:2
Re-reading given values,2,2,E:1 / B:1
Reading LLM's follow-up request,2,1,E:2 / B:0
Recalling formula for a,2,1,E:2 / B:0
Rejecting LLM's suggested approach,2,2,E:1 / B:1
Relaying task parameters to LLM,2,1,E:0 / B:2
Reporting formula derivation to LLM,2,1,E:2 / B:0
Reporting need for reading glasses,2,1,E:2 / B:0
Requesting solution approach from LLM,2,2,E:1 / B:1
Restating calculation,2,2,E:2 / B:0
Restating given ratio,2,2,E:1 / B:1
Restating sub-goal,2,1,E:2 / B:0
Self-correcting calculation approach,2,2,E:1 / B:1
Self-correcting terminology,2,1,E:2 / B:0
Setting up Pythagorean equation,2,1,E:2 / B:0
Simplifying fraction,2,1,E:2 / B:0
Stating intermediate calculation result,2,1,E:2 / B:0
Stating problem givens,2,1,E:2 / B:0
Submitting simplified equation to LLM,2,1,E:2 / B:0
Suspecting own error,2,1,E:0 / B:2
Trailing off mid-thought,2,1,E:2 / B:0
Typing Query to LLM,2,1,E:0 / B:2
Verbalizing intended query before typing,2,1,E:2 / B:0
assigning percentage value on scale,2,1,E:0 / B:2
performing own calculation,2,1,E:0 / B:2
placing point per instruction,2,1,E:0 / B:2
reading definition aloud,2,1,E:0 / B:2
verbalizing message before sending,2,1,E:0 / B:2
voicing a sudden realization,2,1,E:0 / B:2
Abandoning Further Analysis,1,1,E:0 / B:1
Accepting imperfect drawing,1,1,E:1 / B:0
Acknowledging LLM's counter-question,1,1,E:1 / B:0
Acknowledging LLM's response (incomplete),1,1,E:1 / B:0
Acknowledging calculation error,1,1,E:1 / B:0
Acknowledging interface clarification,1,1,E:0 / B:1
Acknowledging misreading error,1,1,E:1 / B:0
Acknowledging own earlier reasoning error,1,1,E:1 / B:0
Acknowledging possible misinterpretation,1,1,E:1 / B:0
Acknowledging think-aloud prompt,1,1,E:1 / B:0
Acknowledging unresolved determination of x,1,1,E:1 / B:0
Adding parentheses for grouping,1,1,E:1 / B:0
Adjusting Pacing Strategy,1,1,E:0 / B:1
Adjusting physical position relative to screen,1,1,E:1 / B:0
Admitting own initial confusion,1,1,E:1 / B:0
Admitting uncertain recall of theorem,1,1,E:1 / B:0
Adopting new-chat-per-task strategy,1,1,E:0 / B:1
Affirming confidence in solution correctness,1,1,E:0 / B:1
Agreeing to researcher's suggestion,1,1,E:1 / B:0
Annotating diagram with values,1,1,E:0 / B:1
Annotating drawing with values,1,1,E:1 / B:0
Announcing Intent to Calculate,1,1,E:0 / B:1
Announcing arc-length calculation step,1,1,E:0 / B:1
Announcing attempt to formulate question,1,1,E:1 / B:0
Announcing closer examination of LLM's suggestion,1,1,E:0 / B:1
Announcing derived formulas,1,1,E:1 / B:0
Announcing image upload to LLM,1,1,E:1 / B:0
Announcing intent to describe own reasoning to LLM,1,1,E:0 / B:1
Announcing intent to share problem statement with LLM,1,1,E:0 / B:1
Announcing intent to solve for target variable,1,1,E:0 / B:1
Announcing message submission,1,1,E:0 / B:1
Announcing transition to calculation,1,1,E:0 / B:1
Announcing writing down of solution,1,1,E:0 / B:1
Answering LLM's guiding question,1,1,E:1 / B:0
Anticipating LLM response,1,1,E:0 / B:1
Anticipating LLM's helpfulness,1,1,E:1 / B:0
Anticipating calculation result,1,1,E:0 / B:1
Anticipating further simplification,1,1,E:1 / B:0
Applying formula to compute circumference,1,1,E:1 / B:0
Applying same rearrangement to second equation,1,1,E:1 / B:0
Applying triangle construction to specific side,1,1,E:0 / B:1
Arriving at simplified fraction result,1,1,E:1 / B:0
Asking About Chat Session Procedure,1,1,E:0 / B:1
Asking About Remaining Task Count,1,1,E:0 / B:1
Asking LLM for angle value,1,1,E:1 / B:0
Asking LLM whether formula exists,1,1,E:1 / B:0
Asking about read-aloud protocol,1,1,E:1 / B:0
Asking how to notate exponent,1,1,E:1 / B:0
Asking permission to consult LLM,1,1,E:0 / B:1
Assessing own capability to solve manually,1,1,E:0 / B:1
Assessing own rusty trigonometry knowledge,1,1,E:1 / B:0
Assessing sufficiency of given information,1,1,E:1 / B:0
Assessing task difficulty relative to prior task,1,1,E:0 / B:1
Assessing task manageability,1,1,E:0 / B:1
Assessing triangle as right-angled from visual impression,1,1,E:1 / B:0
Assigning variable notation,1,1,E:1 / B:0
Assigning variable to unknown height,1,1,E:1 / B:0
Assigning variables to segment lengths,1,1,E:1 / B:0
Assuming LLM comprehension despite ambiguity,1,1,E:1 / B:0
Assuming geometric property from figure,1,1,E:0 / B:1
Assuming x must be positive,1,1,E:1 / B:0
Attempting and rejecting calculation,1,1,E:1 / B:0
Attempting and rejecting incorrect approach,1,1,E:1 / B:0
Attempting to Interpret Given Ratio,1,1,E:0 / B:1
Attempting to access task image,1,1,E:0 / B:1
Attempting to follow LLM's suggested approach,1,1,E:1 / B:0
Attributing LLM's confusion to computed exponents,1,1,E:1 / B:0
Attributing LLM's confusion to own typo,1,1,E:1 / B:0
Attributing LLM's earlier inability to compute exponents,1,1,E:1 / B:0
Attributing confusion to own unclear phrasing,1,1,E:1 / B:0
Attributing discrepancy to rounding error,1,1,E:0 / B:1
Attributing formula source to LLM,1,1,E:0 / B:1
Attributing helpfulness to LLM,1,1,E:1 / B:0
Attributing insight to LLM guidance,1,1,E:1 / B:0
Attributing prior response content to LLM,1,1,E:0 / B:1
Attributing request for formula to task,1,1,E:1 / B:0
"Beginning own reasoning, building on LLM's hint",1,1,E:1 / B:0
Beginning tentative hypothesis (incomplete),1,1,E:1 / B:0
Beginning to parse formula terms,1,1,E:1 / B:0
Calculating Half of Diagonal AC,1,1,E:0 / B:1
Calculating Half of Diagonal BD,1,1,E:0 / B:1
Calculating Half of Diagonal Length,1,1,E:0 / B:1
Calculating answer using calculator,1,1,E:1 / B:0
Calculating midpoint segment,1,1,E:1 / B:0
Calculating part totals and percentages,1,1,E:1 / B:0
Calculating result from formula,1,1,E:0 / B:1
Calculating segment length,1,1,E:1 / B:0
Canceling shared term,1,1,E:1 / B:0
Categorizing problem type,1,1,E:1 / B:0
Challenging LLM's assumption,1,1,E:1 / B:0
Checking calculation output,1,1,E:0 / B:1
Checking for pi-symbol availability,1,1,E:1 / B:0
Checking image-upload availability,1,1,E:1 / B:0
Checking own understanding,1,1,E:1 / B:0
Checking understanding against hint,1,1,E:1 / B:0
Claiming to have found answer,1,1,E:1 / B:0
Clarifying Text Equivalence,1,1,E:0 / B:1
Clarifying answer scope as single edge,1,1,E:0 / B:1
Clarifying correct right-angle location,1,1,E:1 / B:0
Clarifying goal using analogy,1,1,E:1 / B:0
Clarifying note-taking protocol,1,1,E:1 / B:0
Clarifying own question in response to LLM,1,1,E:1 / B:0
Clarifying task procedure with researcher,1,1,E:0 / B:1
Clarifying variable meaning,1,1,E:1 / B:0
Commenting on Rusty Calculator Skills,1,1,E:0 / B:1
Communicating own derived setup to LLM,1,1,E:0 / B:1
Comparing LLM response to own prior reasoning,1,1,E:1 / B:0
Comparing LLM to ChatGPT,1,1,E:0 / B:1
Comparing converted option to computed result,1,1,E:0 / B:1
Comparing result to prior reasoning,1,1,E:1 / B:0
Completing bisection calculation for both diagonals,1,1,E:1 / B:0
Completing calculation independently without consulting LLM,1,1,E:0 / B:1
Completing derived formula,1,1,E:1 / B:0
Completing equation with unknowns,1,1,E:1 / B:0
Completing final multiplication calculation,1,1,E:1 / B:0
Completing hypothesis about edge symmetry,1,1,E:1 / B:0
Composing explanation of Pythagorean application,1,1,E:1 / B:0
Composing explanation of right angles,1,1,E:1 / B:0
Composing explanation of triangle division,1,1,E:1 / B:0
Composing variable definition for target,1,1,E:1 / B:0
Composing variable definitions,1,1,E:1 / B:0
Computing 6^2 and planning subtraction of 27,1,1,E:1 / B:0
Computing angle in degrees,1,1,E:1 / B:0
Computing bounds for a using formula,1,1,E:1 / B:0
Computing decimal equivalent of answer option,1,1,E:0 / B:1
Computing derived value,1,1,E:1 / B:0
Computing final answer from attributed given value,1,1,E:1 / B:0
Computing final answer via summation,1,1,E:1 / B:0
Computing final simplified equation,1,1,E:1 / B:0
Computing numeric value,1,1,E:1 / B:0
Computing powers and planning subtraction,1,1,E:1 / B:0
Computing second half-diagonal values,1,1,E:0 / B:1
Computing second squared value,1,1,E:0 / B:1
Computing sum result,1,1,E:0 / B:1
Computing target length via segment addition,1,1,E:1 / B:0
Computing value of a for verification,1,1,E:1 / B:0
Computing value of b for verification,1,1,E:1 / B:0
Concluding a given is missing,1,1,E:1 / B:0
Concluding correct interpretation via plausibility,1,1,E:1 / B:0
Concluding equation setup,1,1,E:1 / B:0
Concluding hypothetical determinacy,1,1,E:1 / B:0
Concluding midpoint value,1,1,E:1 / B:0
Concluding range for b,1,1,E:1 / B:0
Concluding right angle,1,1,E:1 / B:0
Concluding successful verification,1,1,E:1 / B:0
Confirming CP as height/altitude,1,1,E:1 / B:0
Confirming Calculated Value,1,1,E:0 / B:1
Confirming Correct Understanding,1,1,E:0 / B:1
Confirming LLM's hint as correct,1,1,E:1 / B:0
Confirming Prior Calculation Correct,1,1,E:0 / B:1
Confirming alignment with own prior reasoning,1,1,E:1 / B:0
Confirming assumption before verifying,1,1,E:1 / B:0
Confirming calculated part length,1,1,E:1 / B:0
Confirming calculation makes sense,1,1,E:0 / B:1
Confirming calculation result,1,1,E:1 / B:0
Confirming comprehension of response so far,1,1,E:0 / B:1
Confirming derived formula,1,1,E:1 / B:0
Confirming formula for full circumference,1,1,E:1 / B:0
Confirming further simplification is possible,1,1,E:1 / B:0
Confirming initial interpretation,1,1,E:1 / B:0
Confirming right triangle and requesting formula,1,1,E:1 / B:0
Confirming right-angle triangle determination,1,1,E:1 / B:0
Confirming solution method from response,1,1,E:0 / B:1
Confirming theorem with LLM,1,1,E:1 / B:0
Confirming understanding and recording fractions,1,1,E:1 / B:0
Confirming understanding of LLM's Pythagorean suggestion,1,1,E:0 / B:1
Confirming understanding of LLM's algebraic steps,1,1,E:0 / B:1
Confirming understanding of LLM's repeated Pythagorean suggestion,1,1,E:0 / B:1
Confirming variable assignment,1,1,E:1 / B:0
Confirming verification result,1,1,E:1 / B:0
Connecting half-diagonals to Pythagorean approach,1,1,E:1 / B:0
Considering alternative solving strategy from own academic background,1,1,E:0 / B:1
Considering eliminating shared term,1,1,E:1 / B:0
Considering guessing as a strategy,1,1,E:1 / B:0
Considering missing angle,1,1,E:1 / B:0
Considering querying LLM as fallback,1,1,E:1 / B:0
Considering whether substitution is feasible,1,1,E:1 / B:0
Consolidating known segment lengths,1,1,E:1 / B:0
Constructing auxiliary point in reasoning,1,1,E:1 / B:0
Continuing algebraic rearrangement,1,1,E:1 / B:0
Continuing arc-length calculation,1,1,E:0 / B:1
Continuing computation setup,1,1,E:1 / B:0
Continuing failed calculation attempt,1,1,E:1 / B:0
Continuing percentage estimation attempt,1,1,E:1 / B:0
Continuing radian conversion calculation,1,1,E:0 / B:1
Continuing to convert next answer option,1,1,E:0 / B:1
Continuing work on paper,1,1,E:1 / B:0
Converting next answer option,1,1,E:0 / B:1
Converting ratio to fraction,1,1,E:1 / B:0
Copying formula for reuse,1,1,E:1 / B:0
Copying task text into chat,1,1,E:1 / B:0
Correcting calculation and confirming result,1,1,E:1 / B:0
Correcting count of triangles,1,1,E:0 / B:1
Correcting own calculation setup,1,1,E:1 / B:0
Correcting radius/diameter confusion,1,1,E:1 / B:0
Correcting recalled answer,1,1,E:1 / B:0
Correcting segment length estimate,1,1,E:1 / B:0
Correcting sign error in expression,1,1,E:1 / B:0
Critically evaluating LLM's claim,1,1,E:1 / B:0
Criticizing LLM's failure to detect logic error,1,1,E:1 / B:0
Criticizing response as verbose and insufficiently confirmatory,1,1,E:0 / B:1
Deciding on response to LLM,1,1,E:1 / B:0
Deciding to Consult LLM for Angle Property,1,1,E:0 / B:1
Deciding to apply arccosine,1,1,E:1 / B:0
Deciding to ask LLM a new question,1,1,E:1 / B:0
Deciding to ask for help,1,1,E:1 / B:0
Deciding to attempt mental calculation first,1,1,E:1 / B:0
Deciding to attempt solution without LLM,1,1,E:1 / B:0
Deciding to check remaining answer options,1,1,E:0 / B:1
Deciding to compute final value using calculator,1,1,E:0 / B:1
Deciding to consult LLM again (utterance cuts off),1,1,E:1 / B:0
Deciding to consult LLM due to knowledge gap,1,1,E:0 / B:1
Deciding to consult LLM for formula,1,1,E:1 / B:0
Deciding to consult LLM for guidance,1,1,E:1 / B:0
Deciding to consult LLM with image,1,1,E:1 / B:0
Deciding to continue querying LLM,1,1,E:1 / B:0
Deciding to convert answer options using calculator,1,1,E:0 / B:1
Deciding to copy task using established routine,1,1,E:0 / B:1
Deciding to explain own work to LLM,1,1,E:1 / B:0
Deciding to follow LLM advice,1,1,E:1 / B:0
Deciding to inform LLM of typo correction,1,1,E:1 / B:0
Deciding to query LLM,1,1,E:1 / B:0
Deciding to query LLM for direct solution,1,1,E:1 / B:0
Deciding to re-explain to LLM,1,1,E:1 / B:0
Deciding to re-read task,1,1,E:1 / B:0
Deciding to rearrange equations,1,1,E:1 / B:0
Deciding to reason by plausibility,1,1,E:1 / B:0
Deciding to reconsider LLM's proposed approach,1,1,E:0 / B:1
Deciding to reformat equation with explicit exponents,1,1,E:1 / B:0
Deciding to request formula from LLM,1,1,E:0 / B:1
Deciding to request general approach from LLM,1,1,E:0 / B:1
Deciding to request idea from LLM,1,1,E:0 / B:1
Deciding to share image with LLM,1,1,E:1 / B:0
Deciding to start new chat per task,1,1,E:0 / B:1
Deciding to submit solution for LLM verification,1,1,E:0 / B:1
Deciding to try LLM's suggested equation manipulation,1,1,E:0 / B:1
Deciding to use calculator,1,1,E:1 / B:0
Deciding to use image as LLM input,1,1,E:0 / B:1
Deciding to verify answer by calculation,1,1,E:1 / B:0
Deciding to verify assumption with LLM,1,1,E:1 / B:0
Deciding to verify formula with LLM,1,1,E:1 / B:0
Deciding to verify result with LLM,1,1,E:1 / B:0
Delegating equation-solving task to LLM,1,1,E:0 / B:1
Deriving angle value from clarification,1,1,E:0 / B:1
Deriving bound for x,1,1,E:1 / B:0
Deriving diameter length,1,1,E:0 / B:1
Deriving expression for a in terms of b,1,1,E:1 / B:0
Deriving geometric relationship (bisection),1,1,E:1 / B:0
Deriving inconsistent result,1,1,E:1 / B:0
Deriving length CB from midpoint C,1,1,E:1 / B:0
Deriving midpoint segment lengths,1,1,E:1 / B:0
Deriving range for a,1,1,E:1 / B:0
Deriving ratio formulation from re-read,1,1,E:1 / B:0
Deriving rearranged formula,1,1,E:1 / B:0
Deriving relation between segments,1,1,E:1 / B:0
Deriving right triangle from bisected chord,1,1,E:1 / B:0
Deriving segment length (AN) from given ratios,1,1,E:0 / B:1
"Deriving segment lengths (NC, CB)",1,1,E:0 / B:1
Deriving upper bound for b,1,1,E:1 / B:0
Describing LLM's stepwise equation-solving response,1,1,E:0 / B:1
Describing degree of freedom in figure,1,1,E:1 / B:0
Describing figure,1,1,E:1 / B:0
Describing geometric relationship between sides,1,1,E:1 / B:0
Describing geometric setup for LLM,1,1,E:0 / B:1
Describing substitution strategy,1,1,E:1 / B:0
Detecting error via magnitude check,1,1,E:1 / B:0
Determining boundary values,1,1,E:1 / B:0
Dictating LLM question — reasoning about required third side,1,1,E:1 / B:0
Dictating LLM question — restating givens and triangle setup,1,1,E:1 / B:0
Dictating calculation to LLM,1,1,E:1 / B:0
Dictating combined equation,1,1,E:1 / B:0
Dictating conclusion for message,1,1,E:1 / B:0
Dictating goal for LLM,1,1,E:1 / B:0
Dictating message about equation rearrangement,1,1,E:1 / B:0
Dictating message referencing prior LLM statement,1,1,E:1 / B:0
Dictating problem clarification for LLM,1,1,E:1 / B:0
Dictating problem setup for LLM,1,1,E:1 / B:0
Discovering CoT expansion feature,1,1,E:1 / B:0
Dismissing labeling discrepancy as unimportant,1,1,E:0 / B:1
Distinguishing surface appearance from actual difficulty,1,1,E:0 / B:1
Doubting Applicability of Analogy,1,1,E:0 / B:1
Elaborating bisection reasoning with values,1,1,E:1 / B:0
Elaborating solution reasoning,1,1,E:1 / B:0
Eliminating another answer option,1,1,E:0 / B:1
Eliminating answer option,1,1,E:0 / B:1
Enumerating perceived given quantities,1,1,E:1 / B:0
Enumerating unknowns in sub-triangle ACP,1,1,E:0 / B:1
Enumerating unknowns in sub-triangle BCP,1,1,E:0 / B:1
Estimating proximity to answer option,1,1,E:1 / B:0
Estimating result,1,1,E:1 / B:0
Evaluating LLM response as helpful,1,1,E:0 / B:1
Evaluating intermediate result,1,1,E:1 / B:0
Evaluating own reasoning against response,1,1,E:0 / B:1
Evaluating response's assumption,1,1,E:0 / B:1
Evaluating triangle for isosceles property,1,1,E:0 / B:1
Evaluating usefulness of rearranging equations,1,1,E:1 / B:0
Evaluating whether constraints are sufficient to solve,1,1,E:1 / B:0
Executing trigonometric calculation,1,1,E:1 / B:0
Explaining calculation logic,1,1,E:0 / B:1
Explaining derived bound for b in message,1,1,E:1 / B:0
Explaining formatting choice,1,1,E:1 / B:0
Explaining inability to fully determine length in message,1,1,E:1 / B:0
Explaining own reasoning strategy (sketching aids thinking),1,1,E:0 / B:1
Explaining rearrangement rationale in message,1,1,E:1 / B:0
Explaining vision workaround strategy,1,1,E:1 / B:0
Expressing Difficulty with Task,1,1,E:0 / B:1
Expressing Surprise at LLM's Counter-Question,1,1,E:0 / B:1
Expressing Surprise at Task Count,1,1,E:0 / B:1
Expressing confidence in eventually solving,1,1,E:1 / B:0
Expressing confidence in own solution prior to verification,1,1,E:0 / B:1
Expressing confidence in resolving technical issue,1,1,E:0 / B:1
Expressing confidence reinforced by cross-checking,1,1,E:0 / B:1
Expressing doubt requiring clarification,1,1,E:1 / B:0
Expressing exclamation of understanding,1,1,E:1 / B:0
Expressing expectation of LLM assistance,1,1,E:0 / B:1
Expressing hedged assessment that task requirement is met,1,1,E:0 / B:1
Expressing impasse/lack of ideas,1,1,E:1 / B:0
Expressing inability to find solution path,1,1,E:1 / B:0
Expressing knowledge gap,1,1,E:1 / B:0
Expressing playful confidence via catchphrase,1,1,E:0 / B:1
Expressing reluctance to manually simplify fraction,1,1,E:1 / B:0
Expressing reluctance to solve manually,1,1,E:0 / B:1
Expressing residual doubt about answer,1,1,E:1 / B:0
Expressing sarcastic frustration,1,1,E:1 / B:0
Expressing self-criticism,1,1,E:1 / B:0
Expressing square root as exponent,1,1,E:1 / B:0
Expressing surprise at interface behavior,1,1,E:0 / B:1
Expressing trust in LLM-provided method,1,1,E:0 / B:1
Extending Analogy to Odds Framing,1,1,E:0 / B:1
Extending equal-length assumption to diagonals,1,1,E:1 / B:0
Extending equal-length hypothesis to diagonals,1,1,E:1 / B:0
Extending reasoning toward circle center,1,1,E:1 / B:0
Extracting given diagonal value,1,1,E:0 / B:1
Extracting given values from task,1,1,E:0 / B:1
Flagging Perceived Missing Translation,1,1,E:0 / B:1
Flagging own reasoning as incomplete,1,1,E:0 / B:1
Formalizing problem variables,1,1,E:1 / B:0
Formulating clarification question,1,1,E:1 / B:0
Formulating counterpoint to LLM,1,1,E:0 / B:1
Formulating follow-up question for LLM,1,1,E:1 / B:0
Formulating own sub-question,1,1,E:1 / B:0
Formulating problem statement to send to LLM,1,1,E:0 / B:1
Formulating question (how to obtain the angle),1,1,E:1 / B:0
"Formulating question about angle, not yet finalized",1,1,E:1 / B:0
Formulating solution/question strategy,1,1,E:1 / B:0
Formulating verification question for LLM,1,1,E:1 / B:0
Framing image as baseline context for LLM,1,1,E:1 / B:0
Giving qualified answer to LLM,1,1,E:1 / B:0
Hedging confidence in interpretation,1,1,E:1 / B:0
Hesitating before formulating question,1,1,E:1 / B:0
Hypothesizing alternative sufficient condition,1,1,E:1 / B:0
Hypothesizing bisection approach,1,1,E:1 / B:0
Hypothesizing diagonal bisection,1,1,E:1 / B:0
Hypothesizing equal-edge property of rhombus,1,1,E:1 / B:0
Hypothesizing full-angle value,1,1,E:1 / B:0
Hypothesizing mathematical concept,1,1,E:1 / B:0
Identifying Shape in Diagram,1,1,E:0 / B:1
Identifying additional unknown quantity,1,1,E:0 / B:1
Identifying applicable theorem per LLM guidance,1,1,E:0 / B:1
Identifying arc as relevant quantity,1,1,E:1 / B:0
Identifying arithmetic mistake,1,1,E:0 / B:1
Identifying element in diagram,1,1,E:1 / B:0
Identifying given side,1,1,E:1 / B:0
Identifying hypotenuse in own triangle,1,1,E:1 / B:0
Identifying knowledge gap,1,1,E:1 / B:0
Identifying known and unknown quantities,1,1,E:0 / B:1
Identifying known triangle side lengths,1,1,E:1 / B:0
Identifying missing partial-segment lengths,1,1,E:1 / B:0
Identifying need for formula,1,1,E:0 / B:1
Identifying needed formula,1,1,E:1 / B:0
Identifying next calculation step,1,1,E:1 / B:0
Identifying own calculation error,1,1,E:1 / B:0
Identifying own construction as a linear equation system,1,1,E:0 / B:1
Identifying perpendicularity condition,1,1,E:1 / B:0
Identifying remaining calculation step,1,1,E:0 / B:1
Identifying required multiplication step,1,1,E:1 / B:0
Identifying required variables for calculation,1,1,E:0 / B:1
Identifying solution approach,1,1,E:1 / B:0
Identifying source of confusion,1,1,E:1 / B:0
Identifying source of error,1,1,E:0 / B:1
Identifying sub-triangle with unknown side,1,1,E:1 / B:0
Identifying target quantity,1,1,E:1 / B:0
Identifying target segment on diagram,1,1,E:1 / B:0
Identifying the unknown/goal,1,1,E:1 / B:0
Identifying too many unknowns,1,1,E:1 / B:0
Identifying triangle side (hypotenuse),1,1,E:1 / B:0
Identifying triangle vertices,1,1,E:0 / B:1
Identifying under-determined equation system,1,1,E:0 / B:1
Identifying unknown variable in task,1,1,E:0 / B:1
Identifying unresolved sub-problem (length of AB),1,1,E:0 / B:1
Inferring perpendicularity from distance definition,1,1,E:1 / B:0
Initiating self-questioning about requirements,1,1,E:1 / B:0
Inquiring about answer feedback,1,1,E:1 / B:0
Interpreting LLM question,1,1,E:1 / B:0
Interpreting LLM's approach of combining triangle equations,1,1,E:0 / B:1
Interpreting LLM's assumption,1,1,E:1 / B:0
Interpreting LLM's suggestion to subdivide triangle using variables,1,1,E:0 / B:1
Interpreting diagram markings,1,1,E:1 / B:0
Interpreting diagram to confirm given value,1,1,E:1 / B:0
Interpreting geometric properties,1,1,E:1 / B:0
Interpreting geometric relationship from LLM response,1,1,E:0 / B:1
Interpreting problem geometry,1,1,E:0 / B:1
Interpreting result relative to LLM's response,1,1,E:1 / B:0
Interpreting task requirements for perpendicular construction,1,1,E:0 / B:1
