id,group,raw_label,canonical_label,in_vivo
09.014.1,E,Formulating chatbot query with problem specifics,Formulating chatbot query with problem specifics,"Ich will ein Teil des Umfangs berechnen, wenn ich innen einen Winkel angegeben habe"
09.016.1,E,Identifying knowledge gap,Identifying knowledge gap,das weiß ich natürlich selbst leider nicht
09.016.2,E,Self-correcting terminology,Self-correcting terminology,das ist die Bogenlänge
09.016.3,E,Interpreting chatbot question,Interpreting chatbot question,"fragt er mich, ob ich das noch weiß"
09.016.4,E,Recalling formula from memory,Recalling formula from memory,"war der Pi * r-Quadrat, war der Inhalt?"
09.016.5,E,Deciding to verify recalled formula with chatbot,Deciding to verify recalled formula with chatbot,Ich habe irgendwas von 4 Pi r im Kopf
09.017.1,E,Requesting confirmation of recalled formula,Requesting confirmation of recalled formula,könnte das richit gsein
09.019.1,E,Updating formula based on chatbot correction,Updating formula based on chatbot correction,2 PR scheint es zu sein
09.019.2,E,Confirming formula for full circumference,Confirming formula for full circumference,für den vollen Umfang hätte ich...2 Pi r
09.019.3,E,Hypothesizing full-angle value,Hypothesizing full-angle value,ein voller Winkel sind ja wahrscheinlich 360°
09.019.4,E,Planning ratio-based calculation,Planning ratio-based calculation,das einmal ins Verhältnis setzen
09.019.5,E,Deciding to verify assumption with chatbot,Deciding to verify assumption with chatbot,ob der volle Winkel 360° sind
09.019.6,E,Confirming assumption before verifying,Confirming assumption before verifying,"logischeweise 360 sein, wenn das einmal im Kreis ist"
09.020.1,E,Requesting confirmation from chatbot,Requesting confirmation from chatbot,Wie sit der volle Winkel innen
09.022.1,E,Performing calculation,Performing calculation,"32 durch 360, da habe ich Pi 54"
09.022.2,E,Continuing calculation,Continuing calculation,mal 2 Pi durch r
09.022.4,E,Identifying calculation error,Identifying calculation error,"r ist 18, das ist ein Fehler"
09.022.5,E,Performing calculation,Performing calculation,"das sind knappe 9%, also 0,08"
09.022.6,E,Expressing frustration with repeated calculation errors,Expressing frustration with repeated calculation errors,irgendwas verkackt mich die ganze Zeit
09.022.7,E,Evaluating plausibility of result,Evaluating plausibility of result,das macht allerdings keinen Sinn
09.022.8,E,Recomputing and confirming result,Recomputing and confirming result,"16 durch 5, das sind doch 3,2"
09.022.9,E,Restating problem information,Restating problem information,ich soll jetzt die Kanten berechnen
09.022.10,E,Identifying solution approach,Identifying solution approach,dadurch haben wir 4 rechtwinkelige Dreiecke
09.022.11,E,Deciding to attempt solution without chatbot,Deciding to attempt solution without chatbot,ob ich das ohne Chatbot hinbekomme
09.022.12,E,Performing calculation,Performing calculation,"wieder mal 2, weil wir ja 2 Dreiecke haben"
09.022.13,E,Recognizing mismatch between computed quantity and goal,Recognizing mismatch between computed quantity and goal,ich will die Kantenlänge haben
09.022.14,E,Deciding to verify formula with chatbot,Deciding to verify formula with chatbot,das frage ich zur Sicherheit nochmal nach
09.023.1,E,Requesting formula confirmation from chatbot,Requesting formula confirmation from chatbot,wenn ich die beiden anderen Kantenlängen gegeben habe
09.025.1,E,Recalling relevant theorem,Recalling relevant theorem,das wird wahrscheinlich der Satz des Pythagoras sein
09.025.2,E,Deciding to verify recalled formula with chatbot,Deciding to verify recalled formula with chatbot,"ob ich mir da sicher bin, ob das richtig ist"
09.026.1,E,Confirming theorem with chatbot,Confirming theorem with chatbot,Satz des Pythagoras?
09.028.1,E,Performing calculation,Performing calculation,das passt schon mal nicht
09.028.2,E,Identifying own calculation error,Identifying own calculation error,die Quadrate glaube ich vergessen
09.028.3,E,Correcting calculation and confirming result,Correcting calculation and confirming result,"6^2 plus 8^2 ist dann 10, ja und dann kommt es auch hin"
10.002.1,E,Noting bilingual task text,Noting bilingual task text,da unten steht es noch mal auf Deutsch
10.002.2,E,Recognizing diagram setup,Recognizing diagram setup,wir haben hier wieder so eine schöne Linie
10.002.3,E,Labeling geometric points,Labeling geometric points,"einmal A, B und C"
10.002.4,E,Restating given information,Restating given information,"das Verhältnis AB zu AC, 2 zu 5"
10.002.5,E,Expressing uncertainty about ratio interpretation,Expressing uncertainty about ratio interpretation,jetzt weiß ich nur nicht
10.002.6,E,Formulating clarification question,Formulating clarification question,Was bedeutet das Verhältnis 2 zu 5 in unserem Fall?
10.003.1,E,Submitting clarification query to LLM,Submitting clarification query to LLM,Was bedeutet das Verhältnis 2:5?
10.005.1,E,Asking about read-aloud protocol,Asking about read-aloud protocol,leiser durchlesen
10.007.1,E,Judging response as unhelpful,Judging response as unhelpful,hat es mir jetzt nicht so viel weiter geholfen
10.007.2,E,Acknowledging LLM's counter-question,Acknowledging LLM's counter-question,"er fragt mich, wie ich das Verhältnis berechnen würde"
10.007.3,E,Attempting and rejecting calculation,Attempting and rejecting calculation,"25 durch 2, nee, macht keinen Sinn"
10.007.4,E,Continuing failed calculation attempt,Continuing failed calculation attempt,macht keinen Sinn
10.007.5,E,Trying alternative scaling approach,Trying alternative scaling approach,beides auf 10 mal 2 mache
10.007.6,E,Summarizing conceptual understanding vs. calculation gap,Summarizing conceptual understanding vs. calculation gap,"ich weiß nicht so ganz, wie ich das berechnen würde"
10.008.1,E,Submitting understanding gap to LLM,Submitting understanding gap to LLM,"ich weiß nicht so ganz, wie ich es berechnen würde"
10.010.1,E,Beginning tentative hypothesis (incomplete),Beginning tentative hypothesis (incomplete),"ich glaube, es könnte sein"
10.012.1,E,Restating LLM-provided information,Restating LLM-provided information,"er sagt mir jetzt, AB sind 2 Teile, BC sind 5 Teile"
10.012.2,E,Calculating part totals and percentages,Calculating part totals and percentages,"7 Teile, sind 100%"
10.012.3,E,Reaffirming part-whole relationship,Reaffirming part-whole relationship,7 Teile 100% sind
10.012.4,E,Introducing unknown variable and estimating percentage,Introducing unknown variable and estimating percentage,"eine Länge von x, die wissen wir noch nicht"
10.012.5,E,Continuing percentage estimation attempt,Continuing percentage estimation attempt,2 30% sind
10.012.6,E,Reading LLM instruction aloud and acknowledging,Reading LLM instruction aloud and acknowledging,"Ach so, ja"
10.012.7,E,Reformulating own sub-question,Reformulating own sub-question,Was sind die 5 Teile zu so einem 100%?
10.012.10,E,Restating problem-solving goal,Restating problem-solving goal,"wie ich vorgehen würde, um die Länge eines Teiles zu finden"
10.012.11,E,Recognizing applicable rule-of-three method,Recognizing applicable rule-of-three method,ganz einfacher Dreisatz
10.013.1,E,Submitting method hypothesis for confirmation,Submitting method hypothesis for confirmation,ganz einfacher Dreisatz oder?
10.015.1,E,Claiming to have found answer,Claiming to have found answer,würde ich mich jetzt die Antwort haben
10.015.2,E,Rehearsing request to LLM,Rehearsing request to LLM,Kannst du mir die Länge eines Teiles berechnen?
10.015.3,E,Reviewing given value,Reviewing given value,Gesamtlänge von AC
10.015.4,E,Setting up unknown as variable x,Setting up unknown as variable x,das ist x
10.015.5,E,Repeating rehearsed request,Repeating rehearsed request,Kannst du mir die Länge eines Teiles für richten?
10.017.1,E,Seeking confirmation of given value,Seeking confirmation of given value,ich will nur bestätigt wissen
10.017.2,E,Questioning the ratio relationships,Questioning the ratio relationships,Was sind das für Verhältnisse?
10.017.3,E,Repeating ratio hypothesis aloud,Repeating ratio hypothesis aloud,AB zu AC. AB zu AC.
10.018.1,E,Questioning LLM's stated ratio,Questioning LLM's stated ratio,AB zu AC 2:7?
10.020.1,E,Reading LLM correction aloud and acknowledging,Reading LLM correction aloud and acknowledging,Ach so
10.022.1,E,Restating total parts,Restating total parts,insgesamt sieben Teile
10.022.2,E,Reaffirming known percentage equivalence,Reaffirming known percentage equivalence,sieben Teile sind 100%
10.022.3,E,Identifying next calculation step,Identifying next calculation step,wie lange ein Teil sind
10.022.4,E,Repeating LLM's guiding question,Repeating LLM's guiding question,Das ist ja genau die Frage
10.022.5,E,Performing division calculation,Performing division calculation,25 durch 5
10.022.6,E,Confirming calculated part length,Confirming calculated part length,ein Teil eine Länge von 5 hat
10.022.7,E,Identifying required multiplication step,Identifying required multiplication step,wir brauchen 2 Teile
10.022.8a,E,Completing final multiplication calculation,Completing final multiplication calculation,2 mal fünf sind zehn
10.022.8b,E,Acknowledging own earlier reasoning error,Acknowledging own earlier reasoning error,Boah hatte ich da einen Denkfehler
10.022.9,E,Noting new chat session,Noting new chat session,neuer Chat
10.022.10,E,Reading task question aloud,Reading task question aloud,Was ist die Länge des Kreisabschnittes
10.022.11,E,Expressing confusion about notation,Expressing confusion about notation,x hoch null ist wahrscheinlich dann die Fläche
10.024.1,E,Orienting to circle diagram,Orienting to circle diagram,ich habe hier einen Kreis
10.024.2,E,Interpreting diagram markings,Interpreting diagram markings,"das, was nicht gestrichelt ist"
10.024.3,E,Recognizing need for formula,Recognizing need for formula,"es gibt eine Formel, um das zu berechnen"
10.024.4,E,Struggling with image-paste interface,Struggling with image-paste interface,Wie paste ich da? Command V?
10.024.5,E,Enumerating perceived given quantities,Enumerating perceived given quantities,"wir haben eine Länge, wir haben die Fläche, wir haben den Winkel"
10.025.1,E,Asking LLM whether formula exists,Asking LLM whether formula exists,Gibt es dafür eine Formel?
10.027.1,E,Reiterating belief in existence of formula,Reiterating belief in existence of formula,es gibt da eine Formel
10.027.2,E,Expressing uncertainty about formula,Expressing uncertainty about formula,bin mir aber nicht sicher
10.027.3,E,Speculating about additional required information,Speculating about additional required information,weitere Sachen braucht
10.029.1,E,Restating LLM response and admitting formula unfamiliarity,Restating LLM response and admitting formula unfamiliarity,die kenne ich aber nicht
10.029.2,E,Reiterating lack of formula knowledge,Reiterating lack of formula knowledge,für fast alles immer eine Formel gibt
10.030.1,E,Requesting formula from LLM,Requesting formula from LLM,Wie lautet sie?
10.032.2,E,"Parsing formula, identifying target variable","Parsing formula, identifying target variable","L, also die Bogenlänge, das ist das, was gesucht wird"
10.032.3,E,Expressing confusion about formula symbol,Expressing confusion about formula symbol,"was das ist, so eine Art Grad, keine Ahnung"
10.034.1,E,Parsing formula with clarified symbol,Parsing formula with clarified symbol,Null mit einem Strich durch
10.036.1,E,Describing substitution strategy,Describing substitution strategy,ich schreibe mir immer die Formel auf und setze schon mal ein
10.036.2,E,Restating target variable,Restating target variable,"L ist die Bogenlänge, die wird gesucht"
10.036.3,E,Substituting symbol with task variable,Substituting symbol with task variable,ist in meinem Fall X
10.036.4,E,Substituting given numeric value,Substituting given numeric value,32 durch 360 mal 2πR
10.036.5,E,"Substituting radius value, referencing calculator","Substituting radius value, referencing calculator",müsste mir normalerweise mein Taschenrechner helfen
10.036.6,E,Checking for pi-symbol availability,Checking for pi-symbol availability,gibt es das darauf?
10.038.2,E,Writing full substituted formula,Writing full substituted formula,32 durch 360 mal 2π18
10.038.3,E,Self-correcting calculation approach,Self-correcting calculation approach,Das habe ich falsch gemacht
10.038.4,E,Adding parentheses for grouping,Adding parentheses for grouping,in Klammern setzen
10.038.5,E,Continuing computation setup,Continuing computation setup,"mal 2, mal π, mal 18"
10.038.6,E,Arriving at simplified fraction result,Arriving at simplified fraction result,16/5π
10.038.8,E,Matching result to multiple-choice option,Matching result to multiple-choice option,Das wird wahrscheinlich das erste sein
10.038.9,E,Confirming final answer reasoning,Confirming final answer reasoning,"16 durch 5, mal π"
10.040.2,E,Reading task question aloud,Reading task question aloud,Wie lang sind die Kanten des Diamanten?
10.040.3,E,Deciding to sketch diagram,Deciding to sketch diagram,zeichne ich mir das einmal wieder bildlich auf
10.040.5,E,Annotating drawing with values,Annotating drawing with values,Zahlen da reinschreiben
10.040.6,E,Accepting imperfect drawing,Accepting imperfect drawing,"kein Diamant geworden, aber gut"
10.040.7,E,Labeling diagram points,Labeling diagram points,"C, D und B"
10.040.8,E,Restating given length and computing half,Restating given length and computing half,der hier ist 6
10.040.9,E,Hypothesizing equal-edge property of rhombus,Hypothesizing equal-edge property of rhombus,"alle Kanten, alle Linien müssten eigentlich gleich"
10.040.10,E,Tentatively confirming equal-edge hypothesis,Tentatively confirming equal-edge hypothesis,"theoretisch könnte es sein, dass alle gleich lang sind"
10.040.12,E,Specifying outer edges as equal,Specifying outer edges as equal,Die Äußeren müssten alle gleich lang sein
10.040.13,E,Extending equal-length hypothesis to diagonals,Extending equal-length hypothesis to diagonals,A bis C und B bis D müssten eigentlich alle gleich lang sein
10.041.1,E,Submitting edge-equality hypothesis to LLM,Submitting edge-equality hypothesis to LLM,alle Kanten gleich lang?
10.043.1,E,Restating LLM confirmation of edge equality,Restating LLM confirmation of edge equality,alle 4 Seiten gleich lang sind
10.043.2,E,Extending equal-length assumption to diagonals,Extending equal-length assumption to diagonals,die in der Mitte auch gleich lang sein
10.043.3,E,Expressing doubt requiring clarification,Expressing doubt requiring clarification,"heißt das jetzt nicht, dass die gleich lang sind?"
10.044.1,E,Submitting scope-clarification question to LLM,Submitting scope-clarification question to LLM,alle Linien gemeint? Oder nur die äußeren?
10.046.1,E,Restating LLM clarification on diagonal inequality,Restating LLM clarification on diagonal inequality,die sind nicht gleich lang
10.047.1,E,Seeking explicit confirmation of diagonal inequality,Seeking explicit confirmation of diagonal inequality,die Diagonalen sind nicht gleich lang?
10.049.2,E,Reasoning about diagonal-length implications,Reasoning about diagonal-length implications,die Strecke AC = 12 ist und BD = 16
10.049.5,E,Recognizing Pythagorean theorem applicability,Recognizing Pythagorean theorem applicability,mit einem Satz des Pythagoras die Länge berechnen
10.049.6,E,Identifying missing partial-segment lengths,Identifying missing partial-segment lengths,nicht die Teilstrecken
10.049.7,E,Hypothesizing diagonal bisection,Hypothesizing diagonal bisection,eigentlich muss es ja die Hälfte sein
10.049.8,E,Elaborating bisection reasoning with values,Elaborating bisection reasoning with values,die obere Hälfte 6 sein und die untere Hälfte auch 6
10.049.10,E,Reaffirming confidence in bisection hypothesis,Reaffirming confidence in bisection hypothesis,müsste es schon so sein
10.049.11,E,Interpreting diagram to confirm given value,Interpreting diagram to confirm given value,"AC, 12 sind"
10.051.1,E,Completing bisection calculation for both diagonals,Completing bisection calculation for both diagonals,B bis D sind einmal 8 und 8
10.051.2,E,Connecting half-diagonals to Pythagorean approach,Connecting half-diagonals to Pythagorean approach,mit einem Satz des Pythagoras... Die Länge der Hypotenuse
10.051.3,E,Admitting uncertain recall of theorem,Admitting uncertain recall of theorem,ist zu lange her
10.051.4,E,Specifying triangle side lengths,Specifying triangle side lengths,die eine Seite 6 lang ist und die andere Seite 8 lang ist
10.052.1,E,Submitting request for third-side calculation method,Submitting request for third-side calculation method,wie berechne ich die Länge der dritten Seite?
10.054.2,E,Assessing triangle as right-angled from visual impression,Assessing triangle as right-angled from visual impression,was für mich rechtwinklig aussieht
10.054.3,E,Confirming right-angle triangle determination,Confirming right-angle triangle determination,das ist ein rechtwinkliges Dreieck
10.054.4,E,Reaffirming right-triangle choice over alternative,Reaffirming right-triangle choice over alternative,"Nee, das ist ein rechtwinkliges Dreieck"
10.054.5,E,Recalling Pythagorean theorem formula,Recalling Pythagorean theorem formula,A Quadrat plus B Quadrat gleich C Quadrat
10.055.1,E,Confirming right triangle and requesting formula,Confirming right triangle and requesting formula,Wie lautet der Satz des Pythagoras?
10.057.1a,E,Positively evaluating LLM response,Positively evaluating LLM response,Finde ich gut
10.057.1b,E,Beginning to parse formula terms,Beginning to parse formula terms,gegenrechte Winkel gleich
10.057.2,E,Identifying hypotenuse in own triangle,Identifying hypotenuse in own triangle,die Hypotenuse ist ja praktisch eigentlich diese
10.057.3,E,Describing geometric relationship between sides,Describing geometric relationship between sides,die schneiden sich auch
10.057.4,E,Performing Pythagorean calculation,Performing Pythagorean calculation,6 ins Quadrat plus 8 ins Quadrat... 100
10.057.5,E,Taking square root to reach final answer,Taking square root to reach final answer,komme ich auf 10
11.002.1,B,improvising interface workaround,improvising interface workaround,ich mach das mal mit dem Pluszeichen
11.002.2,B,initiating task reading,initiating task reading,dann lesen wir erstmal die Aufgabe durch
11.002.3,B,restating given information,restating given information,"Radius von 5, die Länge der Linie AB ist 8"
11.002.4,B,restating task question,restating task question,Wie groß ist die Distanz von der Mitte des Kreises O zur Linie AB?
11.002.5,B,deferring own reasoning to consult LLM first,deferring own reasoning to consult LLM first,"Bevor ich darüber nachdenke, frage ich den jetzt erstmal"
11.003.1,B,reiterating task element,reiterating task element,die Distanz von der Mitte des Kreises
11.004.1,B,formulating open-ended query to LLM,formulating open-ended query to LLM,Wie kann ich hier vorgehen
11.006.1,B,extracting key point from response,extracting key point from response,"erstens, Radius des Kreises"
11.006.2,B,reading response aloud verbatim,reading response aloud verbatim,"Bestimmt den Radius des Kreises, falls er nicht gegeben ist"
11.006.3,B,reading response aloud verbatim,reading response aloud verbatim,Die Radius ist die Entfernung von 0 zu jedem Punkt auf Kreisumfang
11.006.4,B,confirming known value,confirming known value,"Radius ist 5, habe ich also schon mal"
11.006.5,B,verbalizing message before typing,verbalizing message before typing,der Radius ist 5
11.007.1,B,providing requested value to LLM,providing requested value to LLM,der Radius ist 5
11.009.1,B,recognizing terminology gap,recognizing terminology gap,"muss ich mir mal eine Liste aufstellen, was hier Begriffe sind"
11.009.2,B,acknowledging need to refresh knowledge,acknowledging need to refresh knowledge,muss ich mal kurz auffrischen
11.010.1,B,requesting definition from LLM,requesting definition from LLM,was ein Tangente und was ist eine Sekante
11.012.1,B,reading definition aloud,reading definition aloud,berührt einen Kreis an genau einem Punkt
11.012.2,B,reading definition aloud,reading definition aloud,schneidet einen Kreis an zwei Punkten
11.012.3,B,applying definition to classify AB,applying definition to classify AB,dann ist AB eine Tangente
11.012.4,B,noting instruction to continue reading,noting instruction to continue reading,dass ich mir das noch weiter lesen soll
11.012.5,B,reading response aloud verbatim,reading response aloud verbatim,den Kreis nur an einem Punkt A schneidet
11.012.6,B,"reading response aloud, trailing into doubt","reading response aloud, trailing into doubt",weil die Tangente...
11.012.8,B,re-checking definition against situation,re-checking definition against situation,sie berührt den Kreis genau an einem Punkt
11.012.9,B,recognizing definitional mismatch,recognizing definitional mismatch,Das ist nicht der Fall
11.012.10,B,re-checking alternate definition,re-checking alternate definition,sie schneidet den Kreis an zwei Punkten
11.012.11,B,identifying conceptual impasse,identifying conceptual impasse,das ist ja beides nicht der Fall
11.014.1,B,attributing image access to LLM,attributing image access to LLM,aber eigentlich hat er ja das Bild
11.014.2,B,forming alternative hypothesis,forming alternative hypothesis,weder eine Tangente noch eine Sekante
11.014.3,B,verbalizing self-monitoring for researcher,verbalizing self-monitoring for researcher,wo ich meinen Denkfehler habe
11.014.4,B,formulating observation for LLM,formulating observation for LLM,AB berührt den Kreis an zwei Punkten
11.014.5,B,hedging confidence in own observation,hedging confidence in own observation,Wenn ich das richtig verstehe
11.015.1,B,sharing observation with LLM,sharing observation with LLM,AB berüht den Kreis an zwei Punkten
11.017.1,B,checking wording equivalence with response,checking wording equivalence with response,'zwei Punkten schneidet' ist das gleiche wie 'zwei Punkten berührt'
11.017.2,B,asserting semantic distinction,asserting semantic distinction,Für mich nicht
11.017.3,B,accepting LLM's classification,accepting LLM's classification,also haben wir eine Sekante
11.017.4,B,prioritizing calculation method over own derivation,prioritizing calculation method over own derivation,ich will wissen wie man es ausrechnet
11.017.6,B,restating response step,restating response step,Das ist eine senkrechte Linie
11.017.7,B,confirming known element from figure,confirming known element from figure,Die senkrechte Linie habe ich
11.017.8,B,reading response step aloud,reading response step aloud,Verwende den Satz des Pythagoras
11.017.9,B,reading response aloud verbatim,reading response aloud verbatim,kannst du ein rechtwinkliges Dreieck bilden
11.017.10,B,identifying triangle vertex,identifying triangle vertex,Bei A
11.017.11,B,restating triangle side labels from response,restating triangle side labels from response,0A und AB ... die Hypotenusen sind...
11.017.13,B,identifying own limitation for LLM,identifying own limitation for LLM,AB kann ich nicht bestimmen
11.017.14,B,qualifying uncertainty about method,qualifying uncertainty about method,ich weiß zumindest nicht wie
11.018.1,B,informing LLM of inability to determine value,informing LLM of inability to determine value,nein AB kann ich nicht bestimmen
11.020.1,B,expressing dawning comprehension,expressing dawning comprehension,Der Groschen fällt langsam
11.020.2,B,confirming derived values,confirming derived values,die beiden Strecken sind fünf
11.020.3,B,confirming coherence of explanation,confirming coherence of explanation,"Das passt, das verstehe ich"
11.020.4,B,decoding notation meaning,decoding notation meaning,"Achso, zur Mitte"
11.020.5,B,restating segment labels,restating segment labels,AP und PB
11.022.1,B,reporting persistent confusion,reporting persistent confusion,"ich weiß immer nicht, wie ich die Strecke zu P ausrechen soll"
11.022.2,B,confirming understood element,confirming understood element,"das ist ja Radius, habe ich verstanden"
11.022.4,B,questioning LLM's epistemic basis for claim,questioning LLM's epistemic basis for claim,weil das kann er ja gar nicht wissen
11.022.5,B,working through equation aloud,working through equation aloud,"5 Quadrat ist gleich, die beiden Werte"
11.023.1,B,declining to provide requested value,declining to provide requested value,nein kann ich DIr nicht sagen
11.025.1,B,evaluating response as repetitive and unhelpful,evaluating response as repetitive and unhelpful,Das ist gefühlt die gleiche Antwort wie vorher
11.025.2,B,inferring own limitation logically,inferring own limitation logically,kann ich logischerweise auch AP nicht bestimmen
11.025.3,B,suspecting missed information,suspecting missed information,Habe ich noch was oben überlesen
11.027.1,B,locating previously missed information,locating previously missed information,Ja ich habs gesehen
11.028.1,B,providing missing value to LLM,providing missing value to LLM,die Länge von AB ist 8
11.030.1,B,performing own calculation,performing own calculation,Dann kann ich logischerweise auch das berechnen
11.030.2,B,questioning whether LLM will compute answer independently,questioning whether LLM will compute answer independently,Rechnet der das jetzt selber für mich aus?
11.030.3,B,confirming LLM computed the answer,confirming LLM computed the answer,Hat er hat doch für mich ausgerechnet
11.030.4,B,expressing satisfaction with outcome,expressing satisfaction with outcome,"Super, vielen Dank"
11.030.5,B,attributing difficulty to own oversight,attributing difficulty to own oversight,dass ich das überlesen habe und somit die Erklärung nicht verstanden habe
11.030.7,B,confirming task identity,confirming task identity,"das ist jetzt die besagte Task, ja?"
11.030.9,B,restating task given values,restating task given values,"A bis C ist gleich 6, BC ist gleich 3"
