canonical_label,frequency,n_participants,group_coverage
Introducing unknown variable and estimating percentage,1,1,E:1 / B:0
Judging LLM's statement as incorrect,1,1,E:1 / B:0
Judging computed precision as sufficient,1,1,E:0 / B:1
Judging own solving capacity as insufficient,1,1,E:1 / B:0
Judging response as unhelpful,1,1,E:1 / B:0
Judging simplification step as easy,1,1,E:1 / B:0
Justifying Analogy with Total Outcomes,1,1,E:0 / B:1
Labeling diagram points,1,1,E:1 / B:0
Labeling diagram variables,1,1,E:1 / B:0
Labeling diagram vertices,1,1,E:1 / B:0
Labeling geometric points,1,1,E:1 / B:0
Labeling given value in drawing,1,1,E:1 / B:0
Labeling known side lengths on diagram,1,1,E:1 / B:0
Labeling point in drawing,1,1,E:1 / B:0
Labeling sketch elements,1,1,E:0 / B:1
Listing given information,1,1,E:1 / B:0
Locating Translated Text,1,1,E:0 / B:1
Locating calculator function,1,1,E:0 / B:1
Making closing remark with humor,1,1,E:1 / B:0
Making self-deprecating remark,1,1,E:1 / B:0
Mapping values onto Pythagorean formula,1,1,E:1 / B:0
Marking identified triangle on sketch,1,1,E:0 / B:1
Marking right angles on diagram,1,1,E:1 / B:0
Matching givens to determinacy case,1,1,E:1 / B:0
Matching result to multiple-choice option,1,1,E:1 / B:0
Miscalculating radius value,1,1,E:1 / B:0
Misreading LLM step aloud,1,1,E:1 / B:0
Misreading given value,1,1,E:1 / B:0
Monitoring for further solving steps from LLM,1,1,E:0 / B:1
Naming result with notation,1,1,E:1 / B:0
Naming verification tool,1,1,E:0 / B:1
Navigating LLM interface,1,1,E:0 / B:1
Noticing LLM's CoT displayed,1,1,E:1 / B:0
Noticing calculation-result mismatch,1,1,E:0 / B:1
Noticing inconsistency in own reasoning,1,1,E:1 / B:0
Noting LLM repeating already-completed step,1,1,E:1 / B:0
Noting LLM's request as already addressed,1,1,E:1 / B:0
Noting answer-option format discrepancy,1,1,E:0 / B:1
Noting bilingual task text,1,1,E:1 / B:0
Noting discrepancy in computed result relative to closest candidate value,1,1,E:0 / B:1
Noting given segment length MN,1,1,E:1 / B:0
Noting given side lengths,1,1,E:1 / B:0
Noting image upload option,1,1,E:1 / B:0
Noting mismatch between own result format and answer options,1,1,E:0 / B:1
Noting new chat session,1,1,E:1 / B:0
Noting right angle at P,1,1,E:1 / B:0
Noting spelling to fix later,1,1,E:1 / B:0
Noting task language mismatch,1,1,E:1 / B:0
Observing LLM's algebraic rearrangement,1,1,E:0 / B:1
Obtaining final result,1,1,E:1 / B:0
Orienting to circle diagram,1,1,E:1 / B:0
Orienting to task before solving,1,1,E:0 / B:1
Paraphrasing LLM's response and answering,1,1,E:1 / B:0
Parsing formula with clarified symbol,1,1,E:1 / B:0
"Parsing formula, identifying target variable",1,1,E:1 / B:0
Pausing to re-verify assumption,1,1,E:0 / B:1
Perceiving LLM as stuck/unresponsive,1,1,E:1 / B:0
Performing final calculation,1,1,E:1 / B:0
Performing intermediate calculation,1,1,E:1 / B:0
Performing manual calculation,1,1,E:0 / B:1
Performing radian conversion calculation,1,1,E:0 / B:1
Performing substitution,1,1,E:1 / B:0
Performing substitution with erroneous expression,1,1,E:1 / B:0
Performing verification calculation,1,1,E:0 / B:1
Placing point N on diagram,1,1,E:1 / B:0
Placing point P on segment AB,1,1,E:1 / B:0
Planning algebraic manipulation,1,1,E:1 / B:0
Planning auxiliary construction,1,1,E:1 / B:0
Planning calculation approach,1,1,E:1 / B:0
Planning degree-to-radian conversion,1,1,E:0 / B:1
Planning further rearrangement,1,1,E:1 / B:0
Planning message content for LLM,1,1,E:1 / B:0
Planning message drafting,1,1,E:1 / B:0
Planning next calculation step (tangent),1,1,E:1 / B:0
Planning own solution approach,1,1,E:1 / B:0
Planning ratio-based calculation,1,1,E:1 / B:0
Planning solution approach,1,1,E:0 / B:1
Planning substitution into equation,1,1,E:1 / B:0
Planning to apply Pythagorean theorem,1,1,E:1 / B:0
Planning to cancel shared x^2 term,1,1,E:1 / B:0
Planning to compute numeric powers,1,1,E:1 / B:0
Planning to compute segment via subtraction,1,1,E:1 / B:0
Planning to derive analogous constraint for a,1,1,E:1 / B:0
Planning to isolate variable,1,1,E:1 / B:0
Planning to rearrange both formulas,1,1,E:1 / B:0
Planning to reference earlier LLM step,1,1,E:1 / B:0
Planning to sketch diagram,1,1,E:1 / B:0
Planning to verify interpretation,1,1,E:1 / B:0
Planning to visualize problem,1,1,E:1 / B:0
Positively evaluating LLM response,1,1,E:1 / B:0
Predicting elimination of variable,1,1,E:1 / B:0
Predicting equations equal zero,1,1,E:1 / B:0
Proposing Calculation Approach,1,1,E:0 / B:1
Proposing approach for LLM verification,1,1,E:1 / B:0
Proposing hypothesis to LLM for verification,1,1,E:1 / B:0
Proposing initial solution approach,1,1,E:1 / B:0
Proposing own hypothesis about symmetry,1,1,E:1 / B:0
Proposing own hypothesis to LLM,1,1,E:1 / B:0
Proposing solution approach,1,1,E:1 / B:0
Proposing trigonometric solution strategy,1,1,E:1 / B:0
Providing combined equation relating x and y,1,1,E:0 / B:1
Providing equation for triangle ACP,1,1,E:0 / B:1
Providing equation for triangle BCP,1,1,E:0 / B:1
Qualifying own knowledge in response to LLM,1,1,E:1 / B:0
Querying LLM about triangle-determination requirements,1,1,E:1 / B:0
Querying LLM for circle-circumference formula,1,1,E:1 / B:0
Querying LLM for formula,1,1,E:0 / B:1
Querying LLM for solution method,1,1,E:0 / B:1
Questioning LLM's stated ratio,1,1,E:1 / B:0
Questioning Own Result,1,1,E:0 / B:1
Questioning angle notation,1,1,E:1 / B:0
Questioning file selection relevance,1,1,E:0 / B:1
Questioning geometric property of figure,1,1,E:0 / B:1
Questioning input formatting,1,1,E:1 / B:0
Questioning own assumption,1,1,E:0 / B:1
Questioning own calculation,1,1,E:0 / B:1
Questioning own notation understanding,1,1,E:1 / B:0
Questioning ratio direction,1,1,E:1 / B:0
Questioning recall of formula,1,1,E:0 / B:1
Questioning solution-validation procedure,1,1,E:1 / B:0
Questioning task terminology,1,1,E:0 / B:1
Questioning the ratio relationships,1,1,E:1 / B:0
Questioning triangle's right-angle assumption,1,1,E:0 / B:1
Questioning unfamiliar notation symbol,1,1,E:0 / B:1
Questioning variable notation,1,1,E:0 / B:1
Quoting LLM instruction,1,1,E:1 / B:0
Re-checking original task statement,1,1,E:1 / B:0
Re-confirming given value,1,1,E:1 / B:0
Re-examining diagram values,1,1,E:0 / B:1
Re-orienting to Task Question,1,1,E:0 / B:1
Re-orienting to Task via Key Term Repetition,1,1,E:0 / B:1
Re-questioning Ratio Meaning,1,1,E:0 / B:1
Re-reading LLM guidance aloud,1,1,E:1 / B:0
"Re-reading LLM response, self-correcting terminology",1,1,E:1 / B:0
Re-reading LLM's hint,1,1,E:1 / B:0
Re-reading and clarifying task description,1,1,E:1 / B:0
Re-reading target question,1,1,E:1 / B:0
Re-reading task constraints,1,1,E:1 / B:0
Re-reading task question to check answer scope,1,1,E:0 / B:1
Re-reading task statement aloud,1,1,E:1 / B:0
Re-reading task to verify,1,1,E:0 / B:1
Re-strategizing after rejecting approach,1,1,E:0 / B:1
Reading LLM correction aloud and acknowledging,1,1,E:1 / B:0
Reading LLM instruction aloud and acknowledging,1,1,E:1 / B:0
Reading LLM's CoT explanation aloud,1,1,E:1 / B:0
Reading LLM's derived relation,1,1,E:1 / B:0
Reading LLM's follow-up instruction,1,1,E:1 / B:0
Reading LLM's hint,1,1,E:1 / B:0
Reading LLM's instruction to solve for x,1,1,E:1 / B:0
Reading LLM's listed hints,1,1,E:1 / B:0
Reading LLM's response prompt,1,1,E:1 / B:0
Reading LLM's restated equations,1,1,E:1 / B:0
Reading LLM's restated givens,1,1,E:1 / B:0
Reading LLM's stated assumption,1,1,E:1 / B:0
Reading LLM's stated next-step goal,1,1,E:1 / B:0
Reading LLM's suggested method,1,1,E:1 / B:0
Reading LLM's suggested next step,1,1,E:1 / B:0
Reading LLM's suggested rearrangement,1,1,E:1 / B:0
Reading LLM's suggested sub-step,1,1,E:1 / B:0
Reading and interpreting task variables,1,1,E:1 / B:0
Reading formula aloud,1,1,E:1 / B:0
Reading given ratio aloud,1,1,E:0 / B:1
Reading given values aloud,1,1,E:1 / B:0
Reading task givens,1,1,E:1 / B:0
Reading task goal aloud,1,1,E:1 / B:0
Reaffirming LLM's triangle-construction claim,1,1,E:0 / B:1
Reaffirming confidence in bisection hypothesis,1,1,E:1 / B:0
Reaffirming constraint that b is positive,1,1,E:1 / B:0
Reaffirming initial guess,1,1,E:1 / B:0
Reaffirming known percentage equivalence,1,1,E:1 / B:0
Reaffirming part-whole relationship,1,1,E:1 / B:0
Reaffirming perpendicularity condition,1,1,E:1 / B:0
Reaffirming right-triangle choice over alternative,1,1,E:1 / B:0
Realizing Answer to LLM's Guiding Question,1,1,E:0 / B:1
Rearranging equation algebraically,1,1,E:1 / B:0
Rearranging equations to isolate terms,1,1,E:1 / B:0
Rearranging first equation,1,1,E:1 / B:0
Rearranging second equation,1,1,E:1 / B:0
Reasoning about diagonal-length implications,1,1,E:1 / B:0
Reasoning about geometric property,1,1,E:0 / B:1
Reasoning about given figure,1,1,E:1 / B:0
Reasoning about given vs. derivable quantities,1,1,E:1 / B:0
Reasoning about positivity from squaring,1,1,E:1 / B:0
Reasoning about relative point positions,1,1,E:1 / B:0
Reasoning about relevant quantity,1,1,E:1 / B:0
Reasoning by Analogy to Dice Probability,1,1,E:0 / B:1
Reasoning through ratio with analogy,1,1,E:1 / B:0
Reasoning toward halving the chord,1,1,E:1 / B:0
Reasoning toward perimeter using side symmetry,1,1,E:0 / B:1
Reassessing available information,1,1,E:1 / B:0
Reassessing sufficiency of information,1,1,E:1 / B:0
Reassessing variable assignment,1,1,E:1 / B:0
Recalculating with corrected formula,1,1,E:0 / B:1
Recalling LLM's labeling of points,1,1,E:0 / B:1
Recalling boundary computation,1,1,E:1 / B:0
Recalling candidate answer (incorrect),1,1,E:1 / B:0
Recalling candidate formula,1,1,E:1 / B:0
Recalling diameter concept,1,1,E:1 / B:0
Recalling diameter-radius relationship,1,1,E:1 / B:0
Recalling formula (possibly incorrect),1,1,E:0 / B:1
Recalling formula from memory,1,1,E:1 / B:0
Recalling formula with self-doubt,1,1,E:1 / B:0
Recalling given value,1,1,E:1 / B:0
Recalling original Pythagorean equations,1,1,E:1 / B:0
Recalling previously derived squared terms,1,1,E:1 / B:0
Recalling radius value,1,1,E:0 / B:1
Recalling relevant theorem,1,1,E:1 / B:0
Recalling trigonometric formula (cosine),1,1,E:1 / B:0
Recognizing LLM's triangle-construction step,1,1,E:0 / B:1
Recognizing Pythagorean theorem applicability,1,1,E:1 / B:0
Recognizing applicable method,1,1,E:1 / B:0
Recognizing applicable rule-of-three method,1,1,E:1 / B:0
Recognizing calculation inconsistency,1,1,E:1 / B:0
Recognizing cancellation of CP^2 term across equations,1,1,E:0 / B:1
Recognizing diagram setup,1,1,E:1 / B:0
Recognizing familiar problem pattern,1,1,E:1 / B:0
Recognizing handwriting-induced transcription error,1,1,E:1 / B:0
Recognizing mismatch between computed quantity and goal,1,1,E:1 / B:0
Recognizing need for formula,1,1,E:1 / B:0
Recognizing need to solve equation system,1,1,E:0 / B:1
Recognizing own reasoning dead-end,1,1,E:1 / B:0
Recognizing own sign error,1,1,E:1 / B:0
Recognizing ratio-as-fraction insight,1,1,E:1 / B:0
Recognizing restated task in reasoning,1,1,E:1 / B:0
Recognizing resulting constraint system,1,1,E:1 / B:0
Recognizing unit error (radians vs. degrees),1,1,E:1 / B:0
Recognizing unresolved variable b in solution,1,1,E:1 / B:0
Recomputing Pythagorean equation,1,1,E:1 / B:0
Recomputing and confirming result,1,1,E:1 / B:0
Recomputing ratio manually to verify,1,1,E:0 / B:1
Recomputing squares step by step,1,1,E:1 / B:0
Reconfirming final answer,1,1,E:0 / B:1
Recording bound for x on paper,1,1,E:1 / B:0
Recording calculated radian value,1,1,E:0 / B:1
Recording computed result,1,1,E:0 / B:1
Recording expression on paper,1,1,E:1 / B:0
Recording given ratio,1,1,E:1 / B:0
Recording given values,1,1,E:1 / B:0
Recording mapped value with uncertainty,1,1,E:1 / B:0
Recording segment value,1,1,E:1 / B:0
Recounting LLM's earlier reasoning,1,1,E:1 / B:0
Recounting LLM's earlier response,1,1,E:1 / B:0
Redoing calculation,1,1,E:0 / B:1
Redrawing diagram to organize reasoning,1,1,E:1 / B:0
Referencing LLM's CoT,1,1,E:1 / B:0
Referencing LLMs's CoT,1,1,E:0 / B:1
Referencing prior LLM statement in message,1,1,E:1 / B:0
Referencing response's suggestion,1,1,E:0 / B:1
Reflecting on LLM reliance strategy,1,1,E:1 / B:0
Reflecting on calculator use,1,1,E:0 / B:1
Reflecting on earlier misunderstanding,1,1,E:1 / B:0
Reflecting on own reasoning capability relative to LLM,1,1,E:1 / B:0
Reflecting on solving the task without LLM assistance,1,1,E:1 / B:0
Reflecting on time taken,1,1,E:0 / B:1
Reflecting on value of writing out steps for error-checking,1,1,E:1 / B:0
Reformatting numbers into exponent form,1,1,E:1 / B:0
Reformulating own sub-question,1,1,E:1 / B:0
Reformulating problem goal,1,1,E:1 / B:0
Reformulating ratio relationship,1,1,E:1 / B:0
Reframing distance as triangle height,1,1,E:1 / B:0
Registering LLM's suggested third equation,1,1,E:0 / B:1
Rehearsing request to LLM,1,1,E:1 / B:0
Reiterating Difficulty Articulating Thoughts,1,1,E:0 / B:1
Reiterating LLM's helpfulness,1,1,E:1 / B:0
Reiterating belief in existence of formula,1,1,E:1 / B:0
Reiterating lack of formula knowledge,1,1,E:1 / B:0
Rejecting incorrect formula recall,1,1,E:1 / B:0
Rejecting own hypothesis,1,1,E:1 / B:0
Rejecting shortcut as against task purpose,1,1,E:0 / B:1
Relating angle to full-circle degrees,1,1,E:1 / B:0
Relaying task prompt to LLM,1,1,E:0 / B:1
Repeating LLM's guiding question,1,1,E:1 / B:0
Repeating ratio hypothesis aloud,1,1,E:1 / B:0
Repeating rehearsed request,1,1,E:1 / B:0
Reporting accidental keypress,1,1,E:1 / B:0
Reporting calculation result to LLM,1,1,E:1 / B:0
Reporting calculator's computed result,1,1,E:1 / B:0
Reporting completion of steps and requesting next steps,1,1,E:0 / B:1
Reporting result and method to LLM,1,1,E:1 / B:0
Requesting Clarification on Diagram Labeling,1,1,E:0 / B:1
Requesting Clarification on Diagram Orientation,1,1,E:0 / B:1
Requesting LLM to solve constructed equation system,1,1,E:0 / B:1
Requesting adjusted formula from LLM,1,1,E:1 / B:0
Requesting approach from LLM,1,1,E:1 / B:0
Requesting clarification from LLM,1,1,E:1 / B:0
Requesting confirmation of recalled formula,1,1,E:1 / B:0
Requesting formula confirmation from LLM,1,1,E:1 / B:0
Requesting formula for AP and PB from LLM,1,1,E:0 / B:1
Requesting help identifying triangle sides,1,1,E:1 / B:0
Requesting help locating error,1,1,E:1 / B:0
Requesting method for finding AB length,1,1,E:0 / B:1
Requesting navigation instruction,1,1,E:1 / B:0
Requesting next steps from LLM,1,1,E:1 / B:0
Requesting solution formula from LLM,1,1,E:0 / B:1
Requesting solution verification from LLM,1,1,E:0 / B:1
Requesting suggestion for resolving underdetermined system,1,1,E:0 / B:1
Requesting technical/keyboard assistance (off-task),1,1,E:1 / B:0
Requesting to view answer options,1,1,E:0 / B:1
Requesting to view task image,1,1,E:0 / B:1
Restating LLM clarification on diagonal inequality,1,1,E:1 / B:0
Restating LLM confirmation of edge equality,1,1,E:1 / B:0
Restating LLM response and admitting formula unfamiliarity,1,1,E:1 / B:0
Restating LLM-provided information,1,1,E:1 / B:0
Restating bound for b with increased confidence,1,1,E:1 / B:0
Restating bounds for a with simplification,1,1,E:1 / B:0
Restating bounds for b,1,1,E:1 / B:0
Restating computed equation,1,1,E:1 / B:0
Restating corrected expression,1,1,E:1 / B:0
Restating derived bound for x for emphasis,1,1,E:1 / B:0
Restating derived expression,1,1,E:1 / B:0
Restating equation,1,1,E:1 / B:0
Restating equation with typo,1,1,E:1 / B:0
Restating given length and computing half,1,1,E:1 / B:0
Restating given point definition,1,1,E:1 / B:0
Restating given value from problem figure,1,1,E:1 / B:0
restating LLM approach,1,1,E:1 / B:0
Restating hypothesized answer prior to full verification,1,1,E:0 / B:1
Restating intended request to LLM,1,1,E:1 / B:0
Restating known quantity,1,1,E:1 / B:0
Restating known values,1,1,E:1 / B:0
Restating known versus unknown values,1,1,E:0 / B:1
Restating original equations,1,1,E:1 / B:0
restating LLM approach,1,1,E:1 / B:0
Restating point definitions,1,1,E:1 / B:0
Restating problem goal,1,1,E:1 / B:0
Commenting problem description,1,1,E:1 / B:0
Restating problem parameters,1,1,E:1 / B:0
Restating problem statement,1,1,E:1 / B:0
restating LLM question,1,1,E:1 / B:0
Restating ratio conclusion,1,1,E:1 / B:0
Restating sub-question,1,1,E:1 / B:0
Restating target unknown,1,1,E:1 / B:0
Restating target variable,1,1,E:1 / B:0
Restating total parts,1,1,E:1 / B:0
Restating value for calculation input,1,1,E:1 / B:0
Resuming Calculation with Given Value,1,1,E:0 / B:1
Retrieving calculator tool,1,1,E:0 / B:1
Returning to LLM with constraint-based reasoning,1,1,E:1 / B:0
Reusing previous equation content,1,1,E:1 / B:0
Reviewing LLM's worked example,1,1,E:1 / B:0
Reviewing available givens,1,1,E:1 / B:0
Reviewing earlier notes,1,1,E:1 / B:0
Reviewing given value,1,1,E:1 / B:0
Reviewing known base segments,1,1,E:1 / B:0
Reviewing prior notes for constraints,1,1,E:1 / B:0
Rounding result to select answer,1,1,E:1 / B:0
Searching for calculation error,1,1,E:1 / B:0
Searching for calculator tool,1,1,E:1 / B:0
Seeking clarification of terminology,1,1,E:0 / B:1
Seeking confirmation of given value,1,1,E:1 / B:0
Seeking explicit confirmation of diagonal inequality,1,1,E:1 / B:0
Seeking expression relating a and b,1,1,E:1 / B:0
Seeking mental representation of problem,1,1,E:1 / B:0
Selecting Pythagorean Theorem Approach,1,1,E:0 / B:1
Selecting answer based on derived bound,1,1,E:1 / B:0
Selecting closest-matching answer,1,1,E:1 / B:0
Selecting final answer despite imprecision,1,1,E:0 / B:1
Selecting solution method,1,1,E:0 / B:1
Self-Correcting Ratio Interpretation,1,1,E:0 / B:1
Self-affirming result plausibility,1,1,E:1 / B:0
Self-correcting by taking square root,1,1,E:0 / B:1
Self-correcting geometric understanding,1,1,E:0 / B:1
Self-correcting given value,1,1,E:1 / B:0
Self-correcting interpretation,1,1,E:1 / B:0
Self-correcting miscalculation,1,1,E:1 / B:0
Self-correcting stated values,1,1,E:1 / B:0
Self-correcting tool terminology,1,1,E:0 / B:1
Self-correcting triangle-count reasoning,1,1,E:0 / B:1
Self-criticizing,1,1,E:0 / B:1
Self-verifying own claim,1,1,E:1 / B:0
Sending clarifying question to LLM,1,1,E:1 / B:0
Setting up Pythagorean equation for triangle APC,1,1,E:1 / B:0
Setting up calculation,1,1,E:0 / B:1
Setting up triangle side lengths,1,1,E:1 / B:0
Setting up unknown as variable x,1,1,E:1 / B:0
Signaling Uncertainty While Continuing,1,1,E:0 / B:1
Signaling intent to work independently,1,1,E:1 / B:0
Signaling reflection pause,1,1,E:0 / B:1
Signaling task completion,1,1,E:1 / B:0
Simplifying squared-root expression,1,1,E:1 / B:0
Sketching diagram,1,1,E:1 / B:0
Sketching diagram on paper,1,1,E:0 / B:1
Sketching diagram with given points,1,1,E:1 / B:0
Sketching triangle,1,1,E:1 / B:0
Skipping intermediate steps,1,1,E:0 / B:1
Solving corrected equation,1,1,E:1 / B:0
Solving equation (erroneous),1,1,E:1 / B:0
Solving equation for x,1,1,E:1 / B:0
Solving equations for x,1,1,E:1 / B:0
Solving for unknown and entering answer,1,1,E:1 / B:0
Specifying angle vertex,1,1,E:1 / B:0
Specifying correct right-angle location,1,1,E:1 / B:0
Specifying outer edges as equal,1,1,E:1 / B:0
Specifying requested formula,1,1,E:1 / B:0
Specifying triangle side lengths,1,1,E:1 / B:0
Speculating about additional required information,1,1,E:1 / B:0
Stating Computed Angle Value,1,1,E:0 / B:1
Stating calculation goal,1,1,E:1 / B:0
Stating calculation result,1,1,E:1 / B:0
Stating calculation target,1,1,E:1 / B:0
Stating computed answer,1,1,E:1 / B:0
Stating computed result,1,1,E:0 / B:1
Stating computed segment value,1,1,E:1 / B:0
Stating interpretation and question to LLM,1,1,E:1 / B:0
Stating problem constraint to LLM,1,1,E:1 / B:0
Stating problem goal,1,1,E:1 / B:0
Stating ratio to LLM,1,1,E:1 / B:0
Stating side calculation,1,1,E:1 / B:0
Stating verification goal,1,1,E:0 / B:1
Struggling with image-paste interface,1,1,E:1 / B:0
Submitting answer to LLM,1,1,E:1 / B:0
Submitting bounding argument to LLM,1,1,E:1 / B:0
Submitting clarification query to LLM,1,1,E:1 / B:0
Submitting combined equation to LLM,1,1,E:1 / B:0
Submitting computed simplification to LLM,1,1,E:1 / B:0
Submitting corrected expression to LLM,1,1,E:1 / B:0
Submitting derived bound for x to LLM,1,1,E:1 / B:0
Submitting derived equations to LLM,1,1,E:1 / B:0
Submitting derived expression to LLM,1,1,E:1 / B:0
Submitting edge-equality hypothesis to LLM,1,1,E:1 / B:0
Submitting method hypothesis for confirmation,1,1,E:1 / B:0
Submitting question to LLM (how to determine the angle),1,1,E:1 / B:0
Submitting rearranged equation to LLM,1,1,E:1 / B:0
Submitting reformatted equation to LLM for confirmation,1,1,E:1 / B:0
Submitting request for third-side calculation method,1,1,E:1 / B:0
Submitting scope-clarification question to LLM,1,1,E:1 / B:0
Submitting simplified equation with explanation,1,1,E:1 / B:0
Submitting solved expression for x to LLM,1,1,E:1 / B:0
Submitting substituted equation to LLM,1,1,E:1 / B:0
Submitting task query to LLM,1,1,E:1 / B:0
Submitting understanding gap to LLM,1,1,E:1 / B:0
Substituting given numeric value,1,1,E:1 / B:0
Substituting given value into equation,1,1,E:1 / B:0
"Substituting radius value, referencing calculator",1,1,E:1 / B:0
Substituting symbol with task variable,1,1,E:1 / B:0
Summarizing conceptual understanding vs. calculation gap,1,1,E:1 / B:0
Summarizing derived formulas for a and x,1,1,E:1 / B:0
Summarizing given task information,1,1,E:0 / B:1
Summing known segments,1,1,E:1 / B:0
Summing squared values,1,1,E:0 / B:1
Switching to calculator for computation,1,1,E:0 / B:1
Taking square root to reach final answer,1,1,E:1 / B:0
Tentatively confirming equal-edge hypothesis,1,1,E:1 / B:0
Testing alternative value,1,1,E:1 / B:0
Testing hypothesis by manual calculation,1,1,E:1 / B:0
Testing whether LLM accepts correction,1,1,E:1 / B:0
Thanking LLM,1,1,E:0 / B:1
Trailing Off Into Silent Thought,1,1,E:0 / B:1
Transcribing equation onto paper,1,1,E:1 / B:0
Transcribing rearranged equation onto paper,1,1,E:1 / B:0
Transitioning to next task,1,1,E:0 / B:1
Transitioning to typing solution in chat,1,1,E:0 / B:1
Trying alternative scaling approach,1,1,E:1 / B:0
Understanding LLM's CoT,1,1,E:0 / B:1
Understanding task number reference,1,1,E:0 / B:1
Updating formula based on LLM correction,1,1,E:1 / B:0
Using analogy to describe shape,1,1,E:1 / B:0
Using calculator tool,1,1,E:0 / B:1
Validating own prior knowledge against response,1,1,E:1 / B:0
Validating viability of LLM's suggested approach,1,1,E:0 / B:1
Valuing LLM assistance,1,1,E:1 / B:0
Verifying answer against original Pythagorean equation,1,1,E:1 / B:0
Verifying answer via substitution,1,1,E:1 / B:0
Verifying problem-setup assumptions before solving,1,1,E:0 / B:1
Verifying right-angle assumption,1,1,E:1 / B:0
Visualizing geometric structure,1,1,E:1 / B:0
Visualizing problem setup,1,1,E:1 / B:0
Vocalizing Numbers Mid-Calculation,1,1,E:0 / B:1
Voicing Confusion About Ratio Meaning,1,1,E:0 / B:1
Weighing alternative solving strategies,1,1,E:1 / B:0
Writing full substituted formula,1,1,E:1 / B:0
Writing second Pythagorean equation,1,1,E:1 / B:0
accepting LLM's classification,1,1,E:0 / B:1
acknowledging forgotten math knowledge,1,1,E:0 / B:1
acknowledging imprecision of own drawing,1,1,E:0 / B:1
acknowledging need to refresh knowledge,1,1,E:0 / B:1
admitting forgotten knowledge,1,1,E:0 / B:1
adopting stepwise problem-solving approach,1,1,E:0 / B:1
agreeing with assessment of insufficiency,1,1,E:0 / B:1
anticipating extended task duration,1,1,E:0 / B:1
applying definition to classify AB,1,1,E:0 / B:1
asking about calculator fraction feature location,1,1,E:0 / B:1
asking about calculator input functionality,1,1,E:0 / B:1
asking about remaining time,1,1,E:0 / B:1
asserting semantic distinction,1,1,E:0 / B:1
attributing computational capability to the calculator,1,1,E:0 / B:1
attributing difficulty to own oversight,1,1,E:0 / B:1
attributing image access to LLM,1,1,E:0 / B:1
attributing offloading to own laziness,1,1,E:0 / B:1
checking alignment with LLM's question,1,1,E:0 / B:1
checking own translation comprehension,1,1,E:0 / B:1
checking response matches own statement,1,1,E:0 / B:1
checking wording equivalence with response,1,1,E:0 / B:1
clarifying fraction bar notation,1,1,E:0 / B:1
clarifying intended request to LLM,1,1,E:0 / B:1
clarifying interface action,1,1,E:0 / B:1
clarifying spatial understanding,1,1,E:0 / B:1
computing value using confirmed relation,1,1,E:0 / B:1
concluding calculation result,1,1,E:0 / B:1
confirming LLM computed the answer,1,1,E:0 / B:1
confirming coherence of response,1,1,E:0 / B:1
confirming derived values,1,1,E:0 / B:1
confirming detail against task text,1,1,E:0 / B:1
confirming known element from figure,1,1,E:0 / B:1
confirming known value,1,1,E:0 / B:1
confirming own calculated result,1,1,E:0 / B:1
confirming point position,1,1,E:0 / B:1
confirming recollection of interface shortcut,1,1,E:0 / B:1
confirming task identity,1,1,E:0 / B:1
confirming understood element,1,1,E:0 / B:1
considering asking LLM for clarification,1,1,E:0 / B:1
considering coordinate-system approach,1,1,E:0 / B:1
considering researching specific concept,1,1,E:0 / B:1
considering self-teaching vector analysis,1,1,E:0 / B:1
considering switching to vector-based approach,1,1,E:0 / B:1
counting out coordinate positions,1,1,E:0 / B:1
deciding to ask explicit verification question,1,1,E:0 / B:1
deciding to consult LLM due to confusion,1,1,E:0 / B:1
deciding to draw diagram to organize understanding,1,1,E:0 / B:1
deciding to proceed despite uncertainty,1,1,E:0 / B:1
deciding to re-read response,1,1,E:0 / B:1
deciding to request verification of own calculation,1,1,E:0 / B:1
declaring sequential reading strategy,1,1,E:0 / B:1
declining to provide requested value,1,1,E:0 / B:1
decoding notation meaning,1,1,E:0 / B:1
deferring own reasoning to consult LLM first,1,1,E:0 / B:1
deliberating how to phrase query to LLM,1,1,E:0 / B:1
