id,group,raw_label,canonical_label,in_vivo
08.020.1,E,Dictating formula for message input,Dictating formula for message input,"6 hoch, 2 gleich, X hoch, a plus 2"
08.021.1,E,Submitting derived equations to chatbot,Submitting derived equations to chatbot,Dann ergeben sich zwei Fomeln nach 6^2 = x^2 + a^2 und 3^2 = x^2 + b^2
08.024.2,E,Noticing chatbot's CoT displayed,Noticing chatbot's CoT displayed,Die KI hat den Gedankenprozess
08.024.3,E,Reading chatbot's follow-up question,Reading chatbot's follow-up question,um eine Gleichung mit nur einer Variablen zu erhalten
08.024.4,E,Predicting elimination of variable,Predicting elimination of variable,da dürfte ja jetzt X wegfallen
08.024.5,E,Deciding to inspect chatbot's CoT,Deciding to inspect chatbot's CoT,den Gedankenprozess von der KI an
08.024.6,E,Reading chatbot's CoT,Reading chatbot's CoT,das Dreieck ABC durch den CP in 2 Rechtwinkel
08.024.7,E,Reading chatbot's CoT,Reading chatbot's CoT,mit Dreieck APC und BPC unterteilt wird
08.024.8,E,Reading chatbot's CoT,Reading chatbot's CoT,die Variablen a für AP und b für PB und X für PC
08.024.9,E,Reading chatbot's listed hints,Reading chatbot's listed hints,"Bisherige Hinweise AC gleich 6, BC gleich 3"
08.024.10,E,Reading chatbot's restated equations,Reading chatbot's restated equations,6^2 gleich X^2 plus a^2 und 3^2 gleich X^2 plus b^2
08.024.11,E,Reading chatbot's derived relation,Reading chatbot's derived relation,AB ist gleich a plus b
08.024.12,E,Reading chatbot's stated next-step goal,Reading chatbot's stated next-step goal,müssen wir die Variablen kombinieren
08.024.13,E,Reading chatbot's suggested method,Reading chatbot's suggested method,die Summe der beiden Gleichungen bilden
08.024.14,E,Restating planned approach,Restating planned approach,die Summe der beiden Gleichungen bilden
08.024.15,E,Re-reading chatbot's question,Re-reading chatbot's question,um die Gleichungen mit nur einer Variablen zu erhalten
08.024.16,E,Planning to rearrange both formulas,Planning to rearrange both formulas,beide Formeln ... umstellen
08.024.17,E,Rearranging equations to isolate terms,Rearranging equations to isolate terms,das 6^2 und das 3^2 auf die andere Seite
08.024.18,E,Predicting equations equal zero,Predicting equations equal zero,auf beiden Seiten 0
08.024.19,E,Deciding to rearrange equations,Deciding to rearrange equations,machen wir das einfach mal
08.024.20,E,Rearranging first equation,Rearranging first equation,X^2 plus a^2 minus 6^2
08.024.21,E,Computing numeric value,Computing numeric value,Ich rechne das mal aus zu 36
08.024.22,E,Applying same rearrangement to second equation,Applying same rearrangement to second equation,Gleich auf der anderen Seite auch
08.024.23,E,Rearranging second equation,Rearranging second equation,"X^2 plus b^2 minus 3^2, also 9"
08.024.24,E,Deciding to query chatbot,Deciding to query chatbot,ich frag jetzt mal die KI
08.024.25,E,Dictating message about equation rearrangement,Dictating message about equation rearrangement,dann kann ich sie gleichsetzen nach
08.024.26,E,Dictating combined equation,Dictating combined equation,X^2 plus a^2 minus 36 ist gleich X^2 plus b^2 minus 9
08.025.1,E,Explaining rearrangement rationale in message,Explaining rearrangement rationale in message,dann kann ich sie gleichsetzen nach
08.025.2,E,Submitting rearranged equation to chatbot,Submitting rearranged equation to chatbot,x^2 + a^2 - 36 = x^2 + b^2 - 9
08.026.1,E,Anticipating further simplification,Anticipating further simplification,wenn ich das hier jetzt weiter auflöse
08.028.1,E,Reading chatbot's suggested rearrangement,Reading chatbot's suggested rearrangement,"so umstellen, dass auf einer Seite 0 steht"
08.028.2,E,Noting chatbot repeating already-completed step,Noting chatbot repeating already-completed step,Das habe ich doch gerade gemacht
08.028.3,E,Deciding to reformat equation with explicit exponents,Deciding to reformat equation with explicit exponents,die Quadrate da wieder reinbaue
08.028.4,E,Copying formula for reuse,Copying formula for reuse,kopiere mir mal kurz die Formel
08.028.5,E,Drafting clarifying question for chatbot,Drafting clarifying question for chatbot,Meinst du das so?
08.028.6,E,Reformatting numbers into exponent form,Reformatting numbers into exponent form,aus der 9 wieder ein 3^2 und aus der 36 ein 6^2
08.029.1,E,Submitting reformatted equation to chatbot for confirmation,Submitting reformatted equation to chatbot for confirmation,x^2 + a^2 - 6^2 = x^2 + b^2 - 3^2
08.031.1,E,Attributing chatbot's confusion to computed exponents,Attributing chatbot's confusion to computed exponents,die KI ist gerade damit nicht klargekommen
08.031.2,E,Reading chatbot's follow-up request,Reading chatbot's follow-up request,gleichsetzen?
08.031.3,E,Noting chatbot's request as already addressed,Noting chatbot's request as already addressed,das habe ich doch gerade da eben eingegeben
08.031.5,E,Reusing previous equation content,Reusing previous equation content,kopiere meine Sachen von oben wieder
08.032.1,E,Submitting combined equation to chatbot,Submitting combined equation to chatbot,x^2 + a^2 - 6^2 = x^2 + b^2 - 3^2
08.034.2,E,Judging simplification step as easy,Judging simplification step as easy,ziemlich simpel
08.034.3,E,Planning to cancel shared x^2 term,Planning to cancel shared x^2 term,das X davon abziehen
08.034.4,E,Deriving simplified equation,Deriving simplified equation,a^2 minus 6^2 gleich b^2 minus 3^2
08.034.5,E,Perceiving chatbot as stuck/unresponsive,Perceiving chatbot as stuck/unresponsive,es scheint die KI dann zu hängen
08.035.1,E,Submitting simplified equation with explanation,Submitting simplified equation with explanation,es ergibt sich a^2 - 6^2 = b^2 - 3^2
08.037.1,E,Reading chatbot's follow-up question,Reading chatbot's follow-up question,weiter vereinfachen?
08.037.2,E,Deciding to follow chatbot advice,Deciding to follow chatbot advice,dann
08.037.3,E,Planning to compute numeric powers,Planning to compute numeric powers,die Potenzen von 6 und 3 ausrechnen
08.037.4,E,Computing powers and planning subtraction,Computing powers and planning subtraction,6 hoch 2 ist gleich 36 und 3 hoch 2 ist gleich 9
08.037.5,E,Deriving simplified equation,Deriving simplified equation,a^2 minus 36 minus 9 ist 27 gleich b^2
08.038.1,E,Submitting computed simplification to chatbot,Submitting computed simplification to chatbot,a^2 - 27 = b^2
08.040.1,E,Reading chatbot's follow-up instruction,Reading chatbot's follow-up instruction,die Gleichung umstellen
08.040.2,E,Planning to isolate variable,Planning to isolate variable,noch einer [Variable] auflösen
08.040.3,E,Deriving expression for a in terms of b,Deriving expression for a in terms of b,A ist gleich b^2 plus 27 ... die Wurzel
08.040.4,E,Expressing square root as exponent,Expressing square root as exponent,hoch 1/2
08.041.1,E,Submitting derived expression to chatbot,Submitting derived expression to chatbot,a = √(b^2 - 27)
08.043.1,E,Reading chatbot's follow-up request,Reading chatbot's follow-up request,Kannst du den Ausdruck für a in die Gleichung
08.043.2,E,Continuing work on paper,Continuing work on paper,auf dem Papier weiter
08.043.3,E,Restating derived expression,Restating derived expression,A gleich Wurzel aus b^2
08.043.4,E,Recognizing own sign error,Recognizing own sign error,da steht minus und kein Plus
08.043.5,E,Planning substitution into equation,Planning substitution into equation,einsetzen in 6^2 gleich x^2 plus a^2
08.043.6,E,Performing substitution with erroneous expression,Performing substitution with erroneous expression,b^2 gleich x^2 plus b^2 plus 27
08.043.7,E,Planning further rearrangement,Planning further rearrangement,die Gleichung wieder umstellen
08.043.8,E,Canceling shared term,Canceling shared term,das b^2 rauskürzen
08.043.9,E,Deriving inconsistent result,Deriving inconsistent result,0 gleich x^2 plus 27
08.043.10,E,Deciding to continue querying chatbot,Deciding to continue querying chatbot,Frangen wir mal die KI weiter
08.043.11,E,Restating equation with typo,Restating equation with typo,6^2 gleich x^2 plus a
08.043.12,E,Recognizing handwriting-induced transcription error,Recognizing handwriting-induced transcription error,wegen meiner Sauklaue aus einer 6 ein b gemacht
08.043.13,E,Reflecting on value of writing out steps for error-checking,Reflecting on value of writing out steps for error-checking,dann fällt dein Fehler auch wieder auf
08.043.14,E,Performing substitution,Performing substitution,Wir setzen oben ein
08.043.15,E,Restating corrected expression,Restating corrected expression,das ist gleich b^2 plus 27
08.044.1,E,Submitting substituted equation to chatbot,Submitting substituted equation to chatbot,6^2 = x^2 + b^2 + 27
08.046.1,E,Reading chatbot's CoT,Reading chatbot's CoT,"Der Benutzer hat versucht, das umzustellen"
08.046.2,E,Reading chatbot's follow-up question,Reading chatbot's follow-up question,den Ausdruck für A korrekt in die Gleichung
08.046.3,E,Interpreting chatbot's assumption,Interpreting chatbot's assumption,"er geht jetzt davon aus, dass"
08.046.4,E,Attributing chatbot's confusion to own typo,Attributing chatbot's confusion to own typo,komplett auf dem Holz weggebracht
08.048.1,E,Deciding to inform chatbot of typo correction,Deciding to inform chatbot of typo correction,ich habe mich vorher vertippt
08.048.3,E,Reviewing earlier notes,Reviewing earlier notes,das hier oben an
08.048.5,E,Correcting sign error in expression,Correcting sign error in expression,aus dem Minus ein Plus
08.048.6,E,Criticizing chatbot's failure to detect logic error,Criticizing chatbot's failure to detect logic error,Logikfehler nicht erkennt
08.049.1,E,Submitting corrected expression to chatbot,Submitting corrected expression to chatbot,a = √(b^2 + 27)
08.051.1,E,Reading chatbot's follow-up question,Reading chatbot's follow-up question,weiter vereinfachen?
08.051.2,E,Simplifying squared-root expression,Simplifying squared-root expression,x^2 plus b^2 plus 27
08.052.1,E,Submitting simplified equation to chatbot,Submitting simplified equation to chatbot,6^2 = x^2 + b^2 + 27
08.054.1,E,Confirming further simplification is possible,Confirming further simplification is possible,weiter vereinfachen
08.054.2a,E,Attributing chatbot's earlier inability to compute exponents,Attributing chatbot's earlier inability to compute exponents,er eben auch schon die Dinger nicht ausrechnen konnte
08.054.2b,E,Computing 6^2 and planning subtraction of 27,Computing 6^2 and planning subtraction of 27,6^2 gleich 36 ... das Substrahieren von 27 von beiden Seiten
08.054.3,E,Computing final simplified equation,Computing final simplified equation,36 minus 27 ist 9 gleich x^2 plus b^2
08.055.1,E,Submitting simplified equation to chatbot,Submitting simplified equation to chatbot,ergibt sich 9 = x^2 + b^2
08.056.1,E,Transcribing equation onto paper,Transcribing equation onto paper,auf dem Papier noch mal auf
08.056.2,E,Restating computed equation,Restating computed equation,9 gleich x^2 plus b^2
08.058.1,E,Reading chatbot's instruction to solve for x,Reading chatbot's instruction to solve for x,die Gleichung nach x auflösen
08.058.2,E,Solving equation for x,Solving equation for x,x ist gleich 9 minus b^2 und daraus die Wurzel
08.059.1,E,Submitting solved expression for x to chatbot,Submitting solved expression for x to chatbot,x = √(9 - b^2)
08.060.1,E,Transcribing rearranged equation onto paper,Transcribing rearranged equation onto paper,Ich schreibe es mir wieder auf
08.060.2,E,Recording expression on paper,Recording expression on paper,x gleich 9 minus b^2 und daraus die Wurzel
08.062.1,E,Reading chatbot's follow-up question,Reading chatbot's follow-up question,"Denk daran, dass b eine Länge ist und daher positiv sein muss"
08.062.2,E,Re-reading chatbot's question for emphasis,Re-reading chatbot's question for emphasis,"Denk daran, dass b eine Länge ist und daher positiv sein muss"
08.062.3,E,Recognizing unresolved variable b in solution,Recognizing unresolved variable b in solution,wir haben da immer noch ein b^2 dran
08.062.4,E,Reviewing prior notes for constraints,Reviewing prior notes for constraints,Was hatten wir denn vorher an Formeln?
08.062.5,E,Recalling previously derived squared terms,Recalling previously derived squared terms,unsere Quadratseiten
08.062.6,E,Reaffirming constraint that b is positive,Reaffirming constraint that b is positive,b eine Länge ist und daher positiv sein muss
08.062.7,E,Reasoning about positivity from squaring,Reasoning about positivity from squaring,es sollte eh positiv werden
08.062.8,E,Assuming x must be positive,Assuming x must be positive,x sollte auch positiv werden
08.062.9,E,Deriving upper bound for b,Deriving upper bound for b,"kleiner gleich 3, würde da 0 rauskommen"
08.062.10,E,Concluding range for b,Concluding range for b,b ist wahrscheinlich irgendwie zwischen 0 und 3
08.062.11,E,Restating bound for b with increased confidence,Restating bound for b with increased confidence,b ist zwischen 0 und 3
08.062.12,E,Recognizing resulting constraint system,Recognizing resulting constraint system,"kriegen dann ein schönes, komplexes System"
08.062.13,E,Expressing self-doubt about reasoning,Expressing self-doubt about reasoning,ich vertue mich jetzt komplett
08.062.14,E,Planning to derive analogous constraint for a,Planning to derive analogous constraint for a,haben wir das Ganze auch nach a gemacht
08.062.15,E,Recalling formula for a,Recalling formula for a,wir haben ja noch die Formel
08.062.16,E,Computing bounds for a using formula,Computing bounds for a using formula,a ist gleich Wurzel aus b^2 plus 27
08.062.17,E,Determining boundary values,Determining boundary values,hätte man die 0 oder 9
08.062.18,E,Deriving range for a,Deriving range for a,größer als die Wurzel aus 27 und kleiner als die Wurzel aus 36
08.062.19,E,Evaluating whether constraints are sufficient to solve,Evaluating whether constraints are sufficient to solve,können wir es damit sinnvoll lösen
08.062.20,E,Redrawing diagram to organize reasoning,Redrawing diagram to organize reasoning,mal mir das Ganze jetzt nochmal auf
08.062.21,E,Labeling diagram vertices,Labeling diagram vertices,"alle Punkte Ecken A,B,C,P"
08.062.22,E,Marking right angles on diagram,Marking right angles on diagram,die beiden rechten Winkel
08.062.23,E,Labeling diagram variables,Labeling diagram variables,X genannt ... a genannt ... b genannt
08.062.24,E,Labeling known side lengths on diagram,Labeling known side lengths on diagram,"Das Ding ist 6, das Ding ist 3"
08.062.25,E,Restating bounds for a with simplification,Restating bounds for a with simplification,"kleiner als die Wurzel aus 36, also kleiner als 6"
08.062.26,E,Restating bounds for b,Restating bounds for b,größer als 0 ist und kleiner als 3
08.062.27,E,Summarizing derived formulas for a and x,Summarizing derived formulas for a and x,a ist die Wurzel aus b^2 plus 27
08.062.28,E,Recalling original Pythagorean equations,Recalling original Pythagorean equations,unsere beiden Pythagoras Formeln
08.062.29,E,Restating original equations,Restating original equations,6^2 gleich X^2 plus a^2 und wir haben 3^2 gleich X^2 plus b^2
08.062.30,E,Considering whether substitution is feasible,Considering whether substitution is feasible,kann man da jetzt sinnvoll irgendwas einsetzen?
08.062.31,E,Considering guessing as a strategy,Considering guessing as a strategy,Kann man das Ding jetzt erraten?
08.062.32,E,Weighing alternative solving strategies,Weighing alternative solving strategies,Werte für a und b zu finden
08.062.33,E,Re-reading chatbot's question before returning to it,Re-reading chatbot's question before returning to it,dass B eine Länge ist und daher positiv sein muss
08.062.34,E,Returning to chatbot with constraint-based reasoning,Returning to chatbot with constraint-based reasoning,Gehen wir da nochmal zurück zum Chatbot
08.062.35,E,Explaining inability to fully determine length in message,Explaining inability to fully determine length in message,da ich keine Wurzel aus einer negativen Zahl ziehen kann
08.062.36,E,Explaining derived bound for b in message,Explaining derived bound for b in message,muss b größer als 0. Und kleiner als 3 sein
08.062.37,E,Acknowledging unresolved determination of x,Acknowledging unresolved determination of x,habe ich X immer noch nicht bestimmt
08.063.1,E,Submitting bounding argument to chatbot,Submitting bounding argument to chatbot,muss b größer als 0 und kleiner als 3 sein
08.065.1,E,Reading chatbot's follow-up question,Reading chatbot's follow-up question,"Denk daran, dass B zwischen 3 liegen muss"
08.065.2,E,Recalling boundary computation,Recalling boundary computation,Wurzel aus 9 und Wurzel aus 0
08.065.3,E,Deriving bound for x,Deriving bound for x,X müsste größer 0 sein und kleiner 3
08.065.4,E,Restating derived bound for x for emphasis,Restating derived bound for x for emphasis,größer als 0 sein und kleiner als 3
08.065.5,E,Recording bound for x on paper,Recording bound for x on paper,"0, kleiner X, kleiner 3"
08.066.1,E,Submitting derived bound for x to chatbot,Submitting derived bound for x to chatbot,x muss größer als 0 sein und kleiner als 3
08.068.1,E,Reading chatbot's follow-up question,Reading chatbot's follow-up question,den Wert für X auswählen?
08.068.2,E,Deciding to inspect chatbot's CoT,Deciding to inspect chatbot's CoT,den Denkprozess nochmal an
08.068.3,E,Reading chatbot's CoT with answer options,Reading chatbot's CoT with answer options,"(A) 2, (B) 4, (C) 5, (D) 7, (E) 8"
08.068.4,E,Selecting answer based on derived bound,Selecting answer based on derived bound,bleibt nur die Antwort 2
08.068.5,E,Deciding to verify answer by calculation,Deciding to verify answer by calculation,mal versuchen nachzurechnen
08.068.6,E,Verifying answer via substitution,Verifying answer via substitution,da muss ja im Prinzip 4 in die Wurzel rauskommen
08.068.7,E,Computing value of b for verification,Computing value of b for verification,b ist gleich Wurzel aus 5
08.068.8,E,Recalling formula for a,Recalling formula for a,A gleich Wurzel aus b^2 plus 27
08.068.9,E,Computing value of a for verification,Computing value of a for verification,"A gleich Wurzel aus 5 plus 27, das ist 32"
08.068.10,E,Verifying answer against original Pythagorean equation,Verifying answer against original Pythagorean equation,"4 plus Wurzel 32 Quadrat, also plus 32"
08.068.11,E,Confirming verification result,Confirming verification result,36 ist gleich 4 plus 32
08.068.12,E,Concluding successful verification,Concluding successful verification,haben wir das gecheckt
08.068.15,E,Reading task givens,Reading task givens,Linie AB hat eine Länge von 10. M ist die Mitte
08.068.16,E,Planning to sketch diagram,Planning to sketch diagram,auf dem Papier
08.068.17,E,Sketching diagram with given points,Sketching diagram with given points,"AB ist 10, wir haben den Mittelpunkt M"
08.068.18,E,Deriving midpoint segment lengths,Deriving midpoint segment lengths,AM ist gleich 5 und BM ist gleich 5
08.068.19,E,Deriving length CB from midpoint C,Deriving length CB from midpoint C,"C B muss 2,5 sein"
08.068.20,E,Placing point N on diagram,Placing point N on diagram,einen Punkt N ein
08.068.21,E,Noting given segment length MN,Noting given segment length MN,M zu N soll 1 sein
08.068.22,E,Restating problem question,Restating problem question,wie lang ist der Abschnitt von N nach C?
08.068.23,E,Identifying target segment on diagram,Identifying target segment on diagram,der hier ist gesucht
08.068.24,E,Reasoning about relative point positions,Reasoning about relative point positions,C liegt auf der Hälfte von MB und M ist die Hälfte von MA
08.068.25,E,Computing target length via segment addition,Computing target length via segment addition,"NC sollte dann 1 plus 2,5 sein. Das ist gleich 3,5"
08.068.26,E,Reflecting on solving the task without chatbot assistance,Reflecting on solving the task without chatbot assistance,brauchte ich dann jetzt keine KI
09.002.2,E,Restating problem information,Restating problem information,"eine große Strecke, die in zwei kleinere Strecken noch unterteilt ist"
09.002.3,E,Identifying task goal,Identifying task goal,"soll berechnen, wie lang die kleine Strecke ist"
09.002.4,E,Identifying given information,Identifying given information,"ein Verhältnis gegeben, allerdings auch für eine Länge, die ich nicht habe"
09.002.5,E,Formalizing problem variables,Formalizing problem variables,AB plus BC ist in Summe AC
09.002.6,E,Restating given information,Restating given information,das Verhältnis von AB zu AC gegeben
09.002.7,E,Deciding to consult chatbot,Deciding to consult chatbot,"frage ich dann direkt mal nach, wie ich das am besten lösen kann"
09.002.8,E,Self-correcting stated values,Self-correcting stated values,im Verhältnis 2 zu 5
09.002.9,E,Planning calculation approach,Planning calculation approach,müsste man selbst jetzt 25 durch 7 teilen
09.002.10,E,Deciding to verify calculation with chatbot,Deciding to verify calculation with chatbot,"frage ich gleich mal in Chatbot, ob das so stimmt"
09.002.11,E,Performing calculation,Performing calculation,"eine Länge von 7 für AB und für AC wäre dann 17,8"
09.002.12,E,Deciding to verify calculation with chatbot,Deciding to verify calculation with chatbot,"frage gleich in Chatbot trotzdem, ob das okay ist"
09.002.13,E,Estimating result,Estimating result,"Das ist dann 7, irgendwas"
09.002.14,E,Deciding to redo calculation more precisely,Deciding to redo calculation more precisely,mache ich das lieber noch mal genauer
09.002.15,E,Testing alternative value,Testing alternative value,"wenn ich jetzt 8 hätte, durch 2 sind 4"
09.002.16,E,Identifying calculation error,Identifying calculation error,schon irgendwas verkackt
09.002.17,E,Rejecting own hypothesis,Rejecting own hypothesis,wird nicht hinkommen
09.002.18,E,Deciding to redo calculation more precisely,Deciding to redo calculation more precisely,mache ich das lieber noch mal genauer
09.003.1,E,Formulating chatbot query,Formulating chatbot query,wie berechne ich dann die Länge der einzelnen STrecken
09.005.1,E,Expressing self-doubt about own approach,Expressing self-doubt about own approach,vielleicht bin ich auch dumm
09.005.2,E,Performing calculation,Performing calculation,2/7 mal 25
09.005.3,E,Confirming calculation result,Confirming calculation result,"dann habe ich die 7,14"
09.007.1,E,Expressing confusion at result mismatch,Expressing confusion at result mismatch,"die Antwortmöglichkeit 7,14 ist nicht vorhanden"
09.007.2,E,Reviewing chatbot's worked example,Reviewing chatbot's worked example,ein Verhältnis von 2 zu 3
09.007.3,E,Applying method to own values,Applying method to own values,das müsste bei mir in diesem Fall 7 sein
09.007.4,E,Applying method to own values,Applying method to own values,"im Zähler habe ich dementsprechend die Zahl von der Strecke, die ich berechne"
09.007.5,E,Performing calculation,Performing calculation,2/7 für die eine Strecke haben und 5 siebtel für die andere
09.007.6,E,Comparing result to prior reasoning,Comparing result to prior reasoning,da komme ich auf krumme Werte
09.007.7,E,Estimating proximity to answer option,Estimating proximity to answer option,2/7 kommt ja relativ nah an 8 dran
09.007.8,E,Testing hypothesis by manual calculation,Testing hypothesis by manual calculation,wenn man jetzt 8 händisch einmal ausrechnet
09.007.9,E,Performing calculation,Performing calculation,hätten wir eine Summe von 28
09.007.10,E,Selecting closest-matching answer,Selecting closest-matching answer,"das, was am nächsten dran kommt"
09.007.11,E,Committing to answer under uncertainty,Committing to answer under uncertainty,"in der Hoffnung, dass man runden darf"
09.007.12,E,Expressing residual doubt about answer,Expressing residual doubt about answer,abgerundet eher 7 wäre als 8
09.007.13,E,Deciding to query chatbot for direct solution,Deciding to query chatbot for direct solution,vielleicht kriege ich eine direkte Lösung ausgespuckt
09.008.1,E,Formulating chatbot query with concrete values,Formulating chatbot query with concrete values,wie würde das dann beispielsweise aussehen
09.010.1a,E,Referencing chatbot's CoT,Referencing chatbot's CoT,im Denkprozess
09.010.1b,E,Comparing chatbot response to own prior reasoning,Comparing chatbot response to own prior reasoning,"sagt er mir eigentlich auch das, was ich mir vorher auch schon gedacht habe"
09.010.2,E,Restating calculation method,Restating calculation method,mit 2/7 und 5/7 rechnet und den jeweiligen Anteil mit 25 multipliziert
09.010.3,E,Rounding result to select answer,Rounding result to select answer,würde ich da jetzt einfach mal die 8 anklicken
09.010.4,E,Identifying target quantity,Identifying target quantity,ab ist ja die kleinere Strecke mit dem Verhältnis 2 zu 5
09.010.5,E,Finalizing answer via rounding,Finalizing answer via rounding,"7,14, dann ist das dementsprechend 8"
09.010.6,E,Restating problem information,Restating problem information,sollen einen Streckenabschnitt auf dem Außenkreis berechnen
09.010.7,E,Identifying given information,Identifying given information,den Radius gegeben und unser X
09.010.8,E,Clarifying variable meaning,Clarifying variable meaning,unser X ist der Winkel
09.010.9,E,Deciding to consult chatbot for formula,Deciding to consult chatbot for formula,dafür gibt es aber einen guten Chatbot
09.011.1,E,Requesting formula from chatbot,Requesting formula from chatbot,Wie ist die Formle zur Berechung des Umfangs eines Kreises
09.013.1a,E,Reflecting on chatbot reliance strategy,Reflecting on chatbot reliance strategy,ohne mir jetzt selbst weiter Gedanken machen zu müssen
09.013.1b,E,Formulating chatbot query intent,Formulating chatbot query intent,wenn ich nur einen Teil des Kreises brauche
09.013.2,E,Self-correcting terminology (Kreis → Umfang des Kreises),Self-correcting terminology (Kreis → Umfang des Kreises),des Umfang des Kreises
