id,group,raw_label,canonical_label,in_vivo
01.001.1,E,Initiating task reading,Initiating task reading,erstmal die Aufgabe lesen
01.001.2,E,Extracting given information,Extracting given information,"Radius 5, die Länge des Abschnitts AB ist 8"
01.001.3,E,Identifying the unknown/goal,Identifying the unknown/goal,die Orthogonale ist gesucht
01.001.4,E,Restating given information,Restating given information,ein Radius gegeben von 5... die Strecke 8 hat
01.001.5,E,Appraising task difficulty,Appraising task difficulty,das ist schon mal auf jeden Fall schwer
01.001.6,E,Announcing image upload to chatbot,Announcing image upload to chatbot,ich füge als erstes mal hier das Bild ein
01.001.7,E,Framing image as baseline context for chatbot,Framing image as baseline context for chatbot,als Grundvoraussetzung dieses Bildchen
01.003.1a,E,Acknowledging chatbot's response (incomplete),Acknowledging chatbot's response (incomplete),"hat erstmal gecheckt, dass ich das..."
01.003.1b,E,Initiating self-questioning about requirements,Initiating self-questioning about requirements,was brauche ich dafür
01.003.2,E,Appraising task difficulty,Appraising task difficulty,eine schwierige Aufgabe auf den ersten Blick
01.003.3,E,Formulating solution/question strategy,Formulating solution/question strategy,was kann ich denn fragen? Wie kann ich das lösen?
01.003.4,E,Planning own solution approach,Planning own solution approach,"einen Weg überlegen, der gehen könnte"
01.003.5a,E,Judging own solving capacity as insufficient,Judging own solving capacity as insufficient,nicht im Kopf hin denke ich
01.003.5b,E,Deciding to consult chatbot,Deciding to consult chatbot,"überlege ich, was ich den Chatbot dazu fragen kann"
01.003.6,E,Seeking mental representation of problem,Seeking mental representation of problem,Ich brauche hier eine Vorstellung
01.003.7,E,Restating given information,Restating given information,"den Radius, der ist 5... die Entfernung dazwischen 8"
01.003.8,E,Proposing trigonometric solution strategy,Proposing trigonometric solution strategy,"mithilfe von Winkeln und dann Cosinus, Sinus"
01.003.9,E,"Formulating question about angle, not yet finalized","Formulating question about angle, not yet finalized",ich habe den zum Beispiel mal
01.003.10,E,Requesting technical/keyboard assistance (off-task),Requesting technical/keyboard assistance (off-task),wo das scharfe S ist
01.003.11,E,Dictating question to chatbot while typing,Dictating question to chatbot while typing,wie groß der Winkel zwischen der Strecke A und B... und der Strecke OB
01.004.1,E,Asking chatbot for angle value,Asking chatbot for angle value,wie gross der winkel ywischen der Strecke AB ist und der Strecke OB
01.005.1,E,Anticipating chatbot's helpfulness,Anticipating chatbot's helpfulness,Das würde mir nämlich direkt weiterhelfen
01.007.1,E,Reading chatbot response aloud,Reading chatbot response aloud,das können wir zusammen herausfinden
01.007.2,E,Confirming chatbot's hint as correct,Confirming chatbot's hint as correct,"Stimmt, es ist einfach ein Radius"
01.007.3,E,Reading chatbot response aloud,Reading chatbot response aloud,Welchen Winkel bildet normalerweise ein Radius mit dem Durchmesser
01.007.4,E,Reflecting on own reasoning capability relative to chatbot,Reflecting on own reasoning capability relative to chatbot,Hätte ich auch selber drauf kommen können
01.007.5,E,"Re-reading chatbot response, self-correcting terminology","Re-reading chatbot response, self-correcting terminology",Endpunkt des Durchmessers
01.007.6,E,Acknowledging own oversight,Acknowledging own oversight,jetzt habe ich das gar nicht gesehen
01.007.7,E,Identifying element in diagram,Identifying element in diagram,Das ist der Radius OB
01.007.8,E,Mapping known value to diagram,Mapping known value to diagram,"Ich weiß, dass das 8 ist"
01.007.9,E,Mapping known value to diagram,Mapping known value to diagram,"Ich weiß, dass das 5 ist"
01.007.10,E,Deriving geometric relationship (bisection),Deriving geometric relationship (bisection),das halbiert die Strecke AB
01.007.11,E,Computing derived value,Computing derived value,dann 4 ist und das ist 5
01.007.12,E,Planning next calculation step,Planning next calculation step,dass ich dann irgendwie das ausrechnen kann
01.007.13a,E,Identifying missing information needed (angle),Identifying missing information needed (angle),Ich bräuchte irgendwie den Winkel
01.007.13b,E,Deciding to consult chatbot again (utterance cuts off),Deciding to consult chatbot again (utterance cuts off),jetzt kann ich den Chatbot
01.007.14a,E,Expressing confidence in eventually solving,Expressing confidence in eventually solving,ich kriege das bestimmt auch
01.007.14b,E,Valuing chatbot assistance,Valuing chatbot assistance,"es ist gut, dass ich jetzt einen Chatbot habe"
01.007.15a,E,Announcing attempt to formulate question,Announcing attempt to formulate question,Ich probiere jetzt mal
01.007.15b,E,Restating known values,Restating known values,das 5 ist und das andere ist 4
01.007.16a,E,Formulating question (how to obtain the angle),Formulating question (how to obtain the angle),wie kriege ich den Winkel
01.007.16b,E,Deciding to consult chatbot,Deciding to consult chatbot,Ich frage den einfach mal
01.007.17,E,Dictating chatbot question — restating givens and triangle setup,Dictating chatbot question — restating givens and triangle setup,ein Dreieck mit zwei bekannten Längen
01.007.18,E,Dictating chatbot question — reasoning about required third side,Dictating chatbot question — reasoning about required third side,muss nur noch die Länge der dritten Seite herausfinden
01.009.1,E,Submitting question to chatbot (how to determine the angle),Submitting question to chatbot (how to determine the angle),wie kann ich den winkel ywischen OB und AB aus diesen informationen bestimmen
01.011.1,E,Reading chatbot response aloud,Reading chatbot response aloud,du bist auf dem richtigen Weg
01.011.2,E,Reading chatbot response aloud,Reading chatbot response aloud,kann direkt mit trigonometrischen Funktionen
01.011.3,E,Reading chatbot response aloud,Reading chatbot response aloud,Welche trigonometrische Funktion würdest du verwenden
01.011.4,E,"Beginning own reasoning, building on chatbot's hint","Beginning own reasoning, building on chatbot's hint",Welche Seite der Ankathete
01.011.5,E,Identifying triangle side (hypotenuse),Identifying triangle side (hypotenuse),Das eine ist die Hypotenuse OB
01.011.6,E,Assessing own rusty trigonometry knowledge,Assessing own rusty trigonometry knowledge,Ein bisschen eingerostet hier
01.011.7a,E,Recalling trigonometric formula (cosine),Recalling trigonometric formula (cosine),Cosinus ist Ankathete durch Hypotenuse
01.011.7b,E,Deciding to apply arccosine,Deciding to apply arccosine,ich mache den Arcus Cosinus
01.011.8,E,Executing trigonometric calculation,Executing trigonometric calculation,"das ist 0,6435"
01.011.9,E,Recognizing unit error (radians vs. degrees),Recognizing unit error (radians vs. degrees),das ist jetzt Bogenmaß gerade
01.011.10a,E,Computing angle in degrees,Computing angle in degrees,"36,869 Grad"
01.011.10b,E,Evaluating plausibility of result,Evaluating plausibility of result,Sieht doch erstmal logisch aus
01.011.11,E,Planning next calculation step (tangent),Planning next calculation step (tangent),"Tangens 36,89 Grad, mal die Länge"
01.011.12,E,Restating value for calculation input,Restating value for calculation input,die Hälfte von AB ist 4
01.011.13a,E,Obtaining final result,Obtaining final result,eine Höhe von 3
01.011.13b,E,Attributing helpfulness to chatbot,Attributing helpfulness to chatbot,hat mir der Chatbot auch gut geholfen
01.011.14a,E,Admitting own initial confusion,Admitting own initial confusion,ein bisschen auf dem Schlauch
01.011.14b,E,Reiterating chatbot's helpfulness,Reiterating chatbot's helpfulness,hat mir dann gut geholfen
02.004.1,B,Flagging Perceived Missing Translation,Flagging Perceived Missing Translation,Ist aber nicht übersetzt.
02.006.1,B,Locating Translated Text,Locating Translated Text,der drunter
02.006.2,B,Clarifying Text Equivalence,Clarifying Text Equivalence,das ist der gleiche Text?
02.008.1,B,Acknowledging Own Oversight,Acknowledging Own Oversight,"Ich habe nicht gesehen, dass das der gleiche Text ist."
02.008.2,B,Reading Task Statement Aloud,Reading Task Statement Aloud,"das Verhältnis der Längen der Abschnitte AB zu AC 2, 5"
02.008.3,B,Reading Task Statement Aloud,Reading Task Statement Aloud,"Wenn AC die Länge 25 hat, wie lang ist dann AB?"
02.008.4,B,Attempting to Interpret Given Ratio,Attempting to Interpret Given Ratio,"Wenn AC 2:5, das heißt..."
02.008.5,B,Vocalizing Numbers Mid-Calculation,Vocalizing Numbers Mid-Calculation,"1, 2, 5."
02.008.6,B,Commenting on Rusty Calculator Skills,Commenting on Rusty Calculator Skills,mit dem Taschenrechner umgehen habe ich das schon lange nicht mehr gemacht
02.008.7,B,Re-reading Given Values,Re-reading Given Values,"Wenn AC die Länge 25 hat, AC ist..."
02.008.8,B,Voicing Confusion About Ratio Meaning,Voicing Confusion About Ratio Meaning,was heißt 2 zu 5?
02.008.9,B,Deciding to Consult Chatbot,Deciding to Consult Chatbot,Fragen wir mal den Chatbot.
02.008.10,B,Asking About Chat Session Procedure,Asking About Chat Session Procedure,soll ich zuerst noch mal einen neuen Chat anlegen
02.010.1,B,Typing Query to Chatbot,Typing Query to Chatbot,was heit das Verhätis 2 zu 5
02.012.1,B,Reading Chatbot Response Aloud,Reading Chatbot Response Aloud,"Das Verhältnis von 2 zu 5 bedeutet, dass die Teile in Bezug auf 5 Teile gesetzt werden."
02.012.2,B,Reading Chatbot Response Aloud,Reading Chatbot Response Aloud,die relativ große oder Menge zu Ergrößen auszudrücken
02.012.3,B,Reading Chatbot Response Aloud,Reading Chatbot Response Aloud,einen Kuchen in 5 gleich große Stücke schneiden
02.012.4,B,Reading Chatbot Response Aloud,Reading Chatbot Response Aloud,das Verhältnis der beiden Stücke zum gesamten Kuchen
02.012.5,B,Reading Chatbot Response Aloud,Reading Chatbot Response Aloud,dieses Verhältnis vereinfachen und erweitern
02.012.6,B,Reading Chatbot Response Aloud,Reading Chatbot Response Aloud,was ein Verhältnis überhaupt bedeutet
02.012.7,B,Comparing Chatbot to ChatGPT,Comparing Chatbot to ChatGPT,Ganz anders als ChatGPT.
02.012.8,B,Resuming Calculation with Given Value,Resuming Calculation with Given Value,wenn das 25 ist
02.014.2,B,Expressing Difficulty with Task,Expressing Difficulty with Task,wie schwer mir das gerade fällt
02.014.3,B,Expressing Frustration/Disbelief,Expressing Frustration/Disbelief,Unglaublich.
02.014.4,B,Restating Given Values,Restating Given Values,25 ist AC und dann 2 zu 5
02.014.5,B,Proposing Calculation Approach,Proposing Calculation Approach,25 dann mal 2 Fünftel
02.014.6,B,Self-Correcting Ratio Interpretation,Self-Correcting Ratio Interpretation,2 zu 5 ist ja nicht das gleiche wie 2 Fünftel
02.014.7,B,Signaling Uncertainty While Continuing,Signaling Uncertainty While Continuing,Da habe ich auf jeden Fall noch so im Kopf. Mal gucken.
02.014.8,B,Abandoning Further Analysis,Abandoning Further Analysis,Egal.
02.014.9,B,Asking About Remaining Task Count,Asking About Remaining Task Count,wie viele Aufgaben habe ich insgesamt noch mal?
02.016.1,B,Expressing Surprise at Task Count,Expressing Surprise at Task Count,Ich habe nur 3?
02.016.2,B,Adjusting Pacing Strategy,Adjusting Pacing Strategy,lasse ich mir ein bisschen mehr Zeit
02.018.1,B,Reiterating Difficulty Articulating Thoughts,Reiterating Difficulty Articulating Thoughts,mir fällt das Nachdenken ganz sicher auch schwer
02.018.2,B,Re-questioning Ratio Meaning,Re-questioning Ratio Meaning,"2 zu 5, was könnte das heißen?"
02.018.3,B,Reasoning by Analogy to Dice Probability,Reasoning by Analogy to Dice Probability,Mit einem Würfel sind ja die Chancen ein Sechstel.
02.018.4,B,Extending Analogy to Odds Framing,Extending Analogy to Odds Framing,die Chancen stehen dann 1 zu 5
02.018.5,B,Justifying Analogy with Total Outcomes,Justifying Analogy with Total Outcomes,man hier insgesamt 6 Möglichkeiten hat
02.018.6,B,Doubting Applicability of Analogy,Doubting Applicability of Analogy,ob das hier mit dem Verhältnis gleich gemeint ist
02.018.7,B,Questioning Own Result,Questioning Own Result,Also wir können ja einfach...
02.018.8,B,Committing to Answer Despite Uncertainty,Committing to Answer Despite Uncertainty,ich bleibe bei der 10
02.018.10,B,Reading Task Statement Aloud,Reading Task Statement Aloud,"A, B, C, D, E, F ein regelmäßiges Sechseck mit dem Mittelpunkt O"
02.018.11,B,Re-reading Task Statement for Comprehension,Re-reading Task Statement for Comprehension,Regelmäßiges Sechseck mit dem Mittelpunkt O.
02.018.12,B,Reading Task Statement Aloud,Reading Task Statement Aloud,Was ist der Wert des Winkels X?
02.018.13,B,Requesting Clarification on Diagram Labeling,Requesting Clarification on Diagram Labeling,X ist zwischen hier den beiden oder was soll X sein?
02.020.1,B,Confirming Correct Understanding,Confirming Correct Understanding,Dann hatte ich das richtig verstanden.
02.020.2,B,Trailing Off Into Silent Thought,Trailing Off Into Silent Thought,regelmäßiges Sechseck wird da vorne...
02.022.2,B,Re-orienting to Task via Key Term Repetition,Re-orienting to Task via Key Term Repetition,Regelmäßiges Sechseck.
02.022.4,B,Identifying Shape in Diagram,Identifying Shape in Diagram,das Parallelogramm
02.022.5,B,Deciding to Consult Chatbot for Angle Property,Deciding to Consult Chatbot for Angle Property,ob es einen festen Winkel für einen regelmäßigen Sechseck gibt
02.022.6,B,Formulating Question for Chatbot,Formulating Question for Chatbot,haben alle Ecken in einem regelmäßigen Sechseck den gleichen Winkel?
02.023.1,B,Typing Query to Chatbot,Typing Query to Chatbot,haben alle Ecken in einem regelmäßigen Sechseck den gleichen Winkel?
02.025.1,B,Reading Chatbot Response Aloud,Reading Chatbot Response Aloud,Das ist eine interessante Frage
02.025.2,B,Reading Chatbot Response Aloud,Reading Chatbot Response Aloud,gemeinsam über die Eigenschaften eines regelmäßigen Sechsecks nachdenken
02.025.3,B,Reading Chatbot Response Aloud,Reading Chatbot Response Aloud,sechs Seiten und sechs Ecken
02.025.4,B,Reading Chatbot Response Aloud,Reading Chatbot Response Aloud,alle Seiten gleich lang sind und alle Winkel gleich groß sind
02.025.5,B,Reading Chatbot Response Aloud,Reading Chatbot Response Aloud,Wie viele Grade hat ein Vollkreis?
02.025.6a,B,Expressing Surprise at Chatbot's Counter-Question,Expressing Surprise at Chatbot's Counter-Question,Hä?
02.025.6b,B,Reading Chatbot Response Aloud,Reading Chatbot Response Aloud,wie viele Grade hat ein Vollkreis und wie viele Ecken hat ein Sechseck?
02.025.7,B,Reading Chatbot Response Aloud,Reading Chatbot Response Aloud,Vielleicht hilft das weiter.
02.025.9,B,Realizing Answer to Chatbot's Guiding Question,Realizing Answer to Chatbot's Guiding Question,"jetzt weiß ich mal, wie viele Gerade"
02.025.10a,B,Performing Division Calculation,Performing Division Calculation,360 durch 6
02.025.10b,B,Thanking Chatbot,Thanking Chatbot,"Vielen Dank, Chatbot."
02.025.11,B,Stating Computed Angle Value,Stating Computed Angle Value,60 Grad ist der Winkel auf jeden Fall dort
02.025.12,B,deriving final angle,deriving final angle,"Der Winkel wird in der Mitte geschnitten, also 30 Grad."
02.025.13,B,Reading Task Statement Aloud,Reading Task Statement Aloud,"die Diagonalen des Diamanten A, B, C, D die folgenden Längen"
02.025.14,B,Reading Task Statement Aloud,Reading Task Statement Aloud,"AC gleich 12, BD gleich 16"
02.025.15,B,Reading Task Statement Aloud,Reading Task Statement Aloud,Wie lang sind die Kanten des Diamanten?
02.025.16,B,Re-reading Task Statement for Comprehension,Re-reading Task Statement for Comprehension,Des Diamanten.
02.025.17,B,Requesting Clarification on Diagram Orientation,Requesting Clarification on Diagram Orientation,Soll der Diamanten stehen oder?
02.027.2,B,Re-orienting to Task Question,Re-orienting to Task Question,was war die Frage nochmal?
02.027.3,B,Restating Given Values,Restating Given Values,Die folgenden Längen AC.
02.027.4,B,Restating Given Values,Restating Given Values,AC sind 12 und BD sind 16
02.027.5,B,Calculating Half of Diagonal Length,Calculating Half of Diagonal Length,"das die Hälfte von 16, 8 ist"
02.027.6,B,Confirming Calculated Value,Confirming Calculated Value,8 haben wir dann dort
02.027.7,B,Announcing Intent to Calculate,Announcing Intent to Calculate,ich berechne jetzt erstmal
02.027.8,B,Re-reading Task Statement to Recall Question,Re-reading Task Statement to Recall Question,"Die Diagonalen des Diamanten A, B, C, D die folgenden Längen."
02.027.9,B,Re-reading Task Statement to Recall Question,Re-reading Task Statement to Recall Question,AC gleich 12. Wie lang sind die Kanten des Diamanten?
02.027.10,B,Confirming Prior Calculation Correct,Confirming Prior Calculation Correct,"doch, ist richtig"
02.027.11,B,Selecting Pythagorean Theorem Approach,Selecting Pythagorean Theorem Approach,über den Satz des Pythagoras
02.027.12,B,Calculating Half of Diagonal AC,Calculating Half of Diagonal AC,die Hälfte von 6
02.027.13,B,Calculating Half of Diagonal BD,Calculating Half of Diagonal BD,"16, die Hälfte ist 8"
02.027.14,B,Applying Pythagorean Theorem to Compute Edge Length,Applying Pythagorean Theorem to Compute Edge Length,die Wurzel aus 8 Quadrat plus 6 Quadrat ist 10
03.002.1,B,Announcing task-reading strategy,Announcing task-reading strategy,dann lese ich mir erstmal die Aufgabenstellung durch
03.002.2,B,Extracting given information from problem statement,Extracting given information from problem statement,Abstand vom Mittelpunkt bis zum Rand ist fünf
03.002.3,B,Interpreting problem geometry,Interpreting problem geometry,irgendwo auf im Bereich der Linie wird das quasi gekreuzt von Linie AB
03.002.4,B,Deciding to consult LLM due to knowledge gap,Deciding to consult LLM due to knowledge gap,mir da jetzt so keine Formel bekannt
03.002.5,B,Announcing intent to share problem statement with LLM,Announcing intent to share problem statement with LLM,gebe ich ihm die Aufgabenstellung mit
03.003.1,B,Requesting solution formula from LLM,Requesting solution formula from LLM,hast du eine Idee mit welcher formel ich diese Aufgabe lösen kann?
03.005.1,B,Rejecting LLM's suggested approach,Rejecting LLM's suggested approach,Abstand punkt gerade hilft glaube ich nicht
03.005.2,B,Re-strategizing after rejecting approach,Re-strategizing after rejecting approach,überlege ich einfach noch mal ein bisschen anders
03.005.3,B,Deriving diameter length,Deriving diameter length,wenn ich eine neue Linie zeichnen würde durch den mittelpunkt dann hätte die länge von 10
03.005.4,B,Announcing intent to describe own reasoning to LLM,Announcing intent to describe own reasoning to LLM,das beschreibe ich ihm jetzt einfach mal
03.005.5,B,Describing geometric setup for LLM,Describing geometric setup for LLM,die Linie von acht ein bisschen weiter unten
03.005.6,B,Expressing expectation of LLM assistance,Expressing expectation of LLM assistance,vielleicht hat er dann eine Idee
03.006.1,B,Communicating own derived setup to LLM,Communicating own derived setup to LLM,wie weit unter der Linie durch den Mittelpunkt die linie ab ist
03.008.1,B,Evaluating LLM response as helpful,Evaluating LLM response as helpful,jetzt glaube ich hilft mir die Beschreibung was
03.008.2,B,Interpreting geometric relationship from LLM response,Interpreting geometric relationship from LLM response,der Abstand vom mittelpunkt zu A oder zu B auch r
03.008.3,B,Deriving half-chord length,Deriving half-chord length,die hälfte von AB ist vier
03.008.4,B,Identifying applicable theorem per LLM guidance,Identifying applicable theorem per LLM guidance,mein satz ist Pythagoras
03.008.5,B,Announcing transition to calculation,Announcing transition to calculation,das rechne ich jetzt einfach mal aus
03.008.6,B,Performing calculation step,Performing calculation step,25 gleich
03.008.7,B,Computing squared value,Computing squared value,16
03.008.8,B,Stating computed result,Stating computed result,das sind dann drei
03.008.9,B,Transitioning to next task,Transitioning to next task,Neue Aufgabe wieder lesen.
03.009.1,B,Interpreting task requirements for perpendicular construction,Interpreting task requirements for perpendicular construction,rechtwinklig auf A und B liegt
03.009.2,B,Deciding to request general approach from LLM,Deciding to request general approach from LLM,ob er da so einen allgemeinen Ansatz hat
03.011.1,B,Adopting new-chat-per-task strategy,Adopting new-chat-per-task strategy,für jede Aufgabe immer neue
03.012.1,B,Requesting solution approach from LLM,Requesting solution approach from LLM,hast du eine Idee wie ich diese aufgabe lösen kann
03.014.1a,B,Confirming understanding of LLM's Pythagorean suggestion,Confirming understanding of LLM's Pythagorean suggestion,das habe ich eigentlich schon verstanden
03.014.1b,B,Identifying unresolved sub-problem (length of AB),Identifying unresolved sub-problem (length of AB),wie lang A und B dann ist
03.014.2a,B,Evaluating triangle for isosceles property,Evaluating triangle for isosceles property,ist es nicht gleichschenklich
03.014.2b,B,Deciding to request idea from LLM,Deciding to request idea from LLM,"frage ich ihn mal, ob er da eine Idee hat"
03.015.1,B,Requesting method for finding AB length,Requesting method for finding AB length,kann ich nicht einfach AB/2 teilen
03.017.1,B,Identifying known and unknown quantities,Identifying known and unknown quantities,die Länge CP kenne ich glaube ich nicht
03.017.2a,B,Identifying additional unknown quantity,Identifying additional unknown quantity,A und B kenne ich auch nicht
03.017.2b,B,Deciding to request formula from LLM,Deciding to request formula from LLM,ob er da eine Formel für mich hat
03.018.1,B,Requesting formula for AP and PB from LLM,Requesting formula for AP and PB from LLM,eine formel für das finden von ap und pb
03.020.2,B,Confirming understanding of LLM's repeated Pythagorean suggestion,Confirming understanding of LLM's repeated Pythagorean suggestion,ist auch irgendwie naheliegend
03.020.3,B,Interpreting LLM's suggestion to subdivide triangle using variables,Interpreting LLM's suggestion to subdivide triangle using variables,dieses Dreieck nochmal in zwei andere Dreiecke zu unterteilen
03.020.4,B,Enumerating unknowns in sub-triangle ACP,Enumerating unknowns in sub-triangle ACP,Von A bis P... weiß ich nicht
03.020.5,B,Enumerating unknowns in sub-triangle BCP,Enumerating unknowns in sub-triangle BCP,das sind zwei Unbekannte auf jeden Fall
03.020.6a,B,Identifying under-determined equation system,Identifying under-determined equation system,drei Unbekannten und zwei Gleichungen
03.020.6b,B,Flagging own reasoning as incomplete,Flagging own reasoning as incomplete,mein Denkfehler gerade noch
03.020.7,B,Considering alternative solving strategy from own academic background,Considering alternative solving strategy from own academic background,so würde ich es in einer WiWi-Klausur machen
03.020.8,B,Rejecting shortcut as against task purpose,Rejecting shortcut as against task purpose,das ist ja nicht Sinn der Sache
03.020.9,B,Deciding to reconsider LLM's proposed approach,Deciding to reconsider LLM's proposed approach,nochmal ein bisschen über seinen Vorschlag nachdenken
03.020.10,B,Formulating problem statement to send to LLM,Formulating problem statement to send to LLM,eine Unbekannte zu viele
03.021.1,B,Requesting suggestion for resolving underdetermined system,Requesting suggestion for resolving underdetermined system,3 unbekannte und 2 gelichungen kann ich nicht lösen
03.023.1,B,Registering LLM's suggested third equation,Registering LLM's suggested third equation,als dritte Gleichung AB = X + Y zu wählen
03.023.2,B,Announcing closer examination of LLM's suggestion,Announcing closer examination of LLM's suggestion,Schau ich mir mal genauer an
03.023.3,B,Interpreting LLM's approach of combining triangle equations,Interpreting LLM's approach of combining triangle equations,die beiden eingeteilten Dreiecke... miteinander zu verrechnen
03.023.4,B,Recognizing cancellation of CP^2 term across equations,Recognizing cancellation of CP^2 term across equations,das die halt entfällt
03.023.5,B,Deciding to try LLM's suggested equation manipulation,Deciding to try LLM's suggested equation manipulation,würde ich jetzt einfach mal ausprobieren
03.023.6,B,Transitioning to typing solution in chat,Transitioning to typing solution in chat,kommen wir hier in den Chat
03.023.7,B,Identifying own construction as a linear equation system,Identifying own construction as a linear equation system,das ist jetzt ein lineares Gleichungssystem
03.023.8,B,Recognizing need to solve equation system,Recognizing need to solve equation system,Das muss ich jetzt einfach auflösen
03.023.9,B,Delegating equation-solving task to LLM,Delegating equation-solving task to LLM,wer das schon für mich macht
03.024.1,B,Requesting LLM to solve constructed equation system,Requesting LLM to solve constructed equation system,löse es mir auf und berechne die lösungen
03.024.2,B,Providing equation for triangle ACP,Providing equation for triangle ACP,36 = x^2 + CP^2
03.024.3,B,Providing equation for triangle BCP,Providing equation for triangle BCP,9 = y^2 + CP^2
03.024.4,B,Providing combined equation relating x and y,Providing combined equation relating x and y,27 = (x-y)(x+y)
03.026.2,B,Observing LLM's algebraic rearrangement,Observing LLM's algebraic rearrangement,hat er schon einiges umgestellt
03.026.5a,B,Confirming understanding of LLM's algebraic steps,Confirming understanding of LLM's algebraic steps,Die Schritte habe ich soweit verstanden
03.026.5b,B,Monitoring for further solving steps from LLM,Monitoring for further solving steps from LLM,ob er noch weitere Schritte macht
