id,group,raw_label,canonical_label,in_vivo
05.016.2,B,Converting next answer option,Converting next answer option,16 mal Pi durch 5
05.016.3,B,Comparing converted option to computed result,Comparing converted option to computed result,das kommt sehr nah an das Radius
05.016.4,B,Deciding to check remaining answer options,Deciding to check remaining answer options,"ich mach einfach mal noch die anderen, nicht dass die am Ende richtig sind"
05.016.5,B,Eliminating answer option,Eliminating answer option,36 mal Pi wird es nicht sein
05.016.6,B,Eliminating another answer option,Eliminating another answer option,36 Pi durch 5 ist auch was ganz anderes
05.016.7,B,Expressing confidence reinforced by cross-checking,Expressing confidence reinforced by cross-checking,fühle ich mich darin bekräftigt
05.016.8,B,Attributing formula source to chatbot,Attributing formula source to chatbot,Ich habe die Formeln bekommen vom Chatbot
05.016.9,B,Expressing trust in chatbot-provided method,Expressing trust in chatbot-provided method,"Ich schenke ihm Glauben und komme auf genau das, was hier steht"
05.016.11,B,Announcing task reading,Announcing task reading,Wollen wir mal wieder lesen
05.016.12,B,Questioning task terminology,Questioning task terminology,"Ich weiß nicht, ob da Diamanat stehen soll?"
05.016.13,B,Seeking clarification of terminology,Seeking clarification of terminology,Oder Diamant?
05.020.3,B,Extracting given diagonal value,Extracting given diagonal value,A zu C ist 12
05.020.4,B,Restating task question,Restating task question,Wie lang sind die Kanten des Diamanten?
05.020.6,B,Deciding to copy task using established routine,Deciding to copy task using established routine,"Klassischer Weg, wieder kopieren"
05.020.7,B,Expressing surprise at interface behavior,Expressing surprise at interface behavior,Das hab ich mir anders vorgestellt
05.020.8,B,Expressing confidence in resolving technical issue,Expressing confidence in resolving technical issue,Das kriegen wir schon noch hin
05.020.11,B,Marking action completion,Marking action completion,Zack
05.021.1,B,Relaying task parameters to LLM,Relaying task parameters to LLM,"AC = 12, BD = 16"
05.023.1,B,Reading LLM response aloud,Reading LLM response aloud,die andere Diagonale in zwei gleiche Teile
05.023.2,B,Reading LLM response aloud,Reading LLM response aloud,jedes Segment
05.023.3,B,Confirming comprehension of response so far,Confirming comprehension of response so far,soweit so Gut
05.023.4,B,Recognizing LLM's triangle-construction step,Recognizing LLM's triangle-construction step,möchte der da aus Dreieck bauen
05.023.6,B,Reading LLM response aloud,Reading LLM response aloud,Jede Seite
05.023.7,B,Pausing to re-verify assumption,Pausing to re-verify assumption,lass mich nochmal nachschauen
05.023.8,B,Questioning geometric property of figure,Questioning geometric property of figure,Haben die rechte Winkel?
05.023.10,B,Self-correcting geometric understanding,Self-correcting geometric understanding,die schneiden sich am rechten Winkel
05.023.12,B,Deciding to sketch diagram to support reasoning,Deciding to sketch diagram to support reasoning,Ich male mir [das] mal auf
05.023.13,B,Labeling sketch elements,Labeling sketch elements,C und D
05.025.2,B,Explaining own reasoning strategy (sketching aids thinking),Explaining own reasoning strategy (sketching aids thinking),"weil ich kann besser denken, wenn ich die Sachen tatsächlich daran schreibe"
05.025.3,B,Computing half-diagonal values,Computing half-diagonal values,"A bis C ist 12, das heißt diesen 6 [und] 6"
05.025.4,B,Computing second half-diagonal values,Computing second half-diagonal values,"die andere ist 16, also 8 [und] 8"
05.025.5,B,Attributing prior response content to chatbot,Attributing prior response content to chatbot,das wurde mir von dem schon erklärt
05.025.6,B,Recalling chatbot's labeling of points,Recalling chatbot's labeling of points,Er hat das BO und O
05.025.8,B,Dismissing labeling discrepancy as unimportant,Dismissing labeling discrepancy as unimportant,"Hat er anders genannt, ist mir egal"
05.025.9,B,Reaffirming LLM's triangle-construction claim,Reaffirming LLM's triangle-construction claim,Jede Seite der Raute bildet mit dem... rechtwinkliges Dreieck
05.025.10,B,Applying triangle construction to specific side,Applying triangle construction to specific side,bilden A zu B
05.025.11,B,Correcting count of triangles,Correcting count of triangles,in vier [Dreiecke]
05.025.13,B,Self-correcting triangle-count reasoning,Self-correcting triangle-count reasoning,"wir machen uns vier, ah, zwei Dreiecke. Aber wir machen die vier"
05.025.15,B,Identifying triangle vertices,Identifying triangle vertices,"Zu A, B und O"
05.025.16,B,Marking identified triangle on sketch,Marking identified triangle on sketch,das hier ist eins
05.025.17,B,Identifying remaining calculation step,Identifying remaining calculation step,Jetzt braucht ihr nur noch die Rechnung davon
05.025.18,B,Recalling Pythagorean theorem for calculation,Recalling Pythagorean theorem for calculation,"den Satz [von Pythagoras] brauchen um die Länge von A, B zu finden"
05.025.19,B,Restating known versus unknown values,Restating known versus unknown values,ich habe die Länge... und ihr findet nur noch die
05.025.20,B,Expressing playful confidence via catchphrase,Expressing playful confidence via catchphrase,Pythagoras to the rescue
05.025.22,B,Switching to calculator for computation,Switching to calculator for computation,der Taschenrechner
05.025.23,B,"Performing Pythagorean calculation step (verbal slip, self-corrected in 025.24–025.28)","Performing Pythagorean calculation step (verbal slip, self-corrected in 025.24–025.28)","8 mal 6 ...mit AO Quadrat, das ist AO"
05.025.24,B,Computing squared value,Computing squared value,6 mal 6 sind 36
05.025.25,B,Computing second squared value,Computing second squared value,8 mal 8 sind 64
05.025.26,B,Summing squared values,Summing squared values,Plus 64
05.025.27,B,Computing sum result,Computing sum result,müsste das 100 sein
05.025.28,B,Self-correcting by taking square root,Self-correcting by taking square root,das ist 10... weil Wurzel
05.025.29,B,Reasoning toward perimeter using side symmetry,Reasoning toward perimeter using side symmetry,"da die Seiten alle gleich sind, ist der Umfang von dem Teil..."
05.025.30,B,Re-reading task question to check answer scope,Re-reading task question to check answer scope,wie lang sind die Kanten?
05.025.31,B,Clarifying answer scope as single edge,Clarifying answer scope as single edge,wir rechnen nur vor einer Kante
05.025.32,B,Finalizing answer with alternative scope noted,Finalizing answer with alternative scope noted,"eine Kante 10, ansonsten werden es 40"
07.002.1,E,Stating problem givens,Stating problem givens,einen Kreis mit einem Radius 5 und die Länge der Linie AB ist 8
07.002.2,E,Restating problem question,Restating problem question,Wie groß ist die Distanz von der Mitte des Kreises zur Linie AB?
07.002.3,E,Categorizing problem type,Categorizing problem type,Berechnung einer Sekante
07.002.4,E,Constructing auxiliary triangle,Constructing auxiliary triangle,Radius 5 habe ich ein gleichseitiges Dreieck
07.002.5,E,Setting up triangle side lengths,Setting up triangle side lengths,mit 5 und 5. Die Hypotenuse ist 8.
07.002.6,E,Deriving right triangle from bisected chord,Deriving right triangle from bisected chord,die Hälfte von AB ist 4. Damit habe ich ein rechtwinkliges Dreieck
07.002.7,E,Formulating equation,Formulating equation,x^2 plus 4^2 ist gleich 5^2
07.002.8,E,Recognizing familiar problem pattern,Recognizing familiar problem pattern,die klassische Geschichte
07.002.9,E,Stating computed answer,Stating computed answer,ich bin auf x gleich 3
07.003.1b,E,Questioning solution-validation procedure,Questioning solution-validation procedure,Wie ist das mit der Lösungsvalidierung?
07.005.2,E,Reporting need for reading glasses,Reporting need for reading glasses,Ich brauche eine Lesebrille
07.005.3a,E,Misreading given value,Misreading given value,BC ist 6
07.005.3b,E,Self-correcting given value,Self-correcting given value,BC ist 3
07.005.4,E,Restating problem statement,Restating problem statement,"Lies on AB, between AB"
07.005.5,E,Restating problem question,Restating problem question,which for following could be the length of CP?
07.005.6,E,Re-confirming given value,Re-confirming given value,"6, BC ist 3"
07.007.1,E,Labeling given value in drawing,Labeling given value in drawing,BC ist 3
07.007.2,E,Identifying target value,Identifying target value,letztendlich hier 6 gesucht
07.007.3,E,Identifying target value,Identifying target value,Die ist gesucht
07.007.4,E,Deciding to ask for help,Deciding to ask for help,Da muss ich jetzt doch mal fragen
07.007.5,E,Identifying needed formula,Identifying needed formula,Die Formel für die Höhe
07.007.6,E,Assessing sufficiency of given information,Assessing sufficiency of given information,Ich habe hier genügend Informationen
07.007.7,E,Expressing uncertainty about right angle,Expressing uncertainty about right angle,"Ich weiß nicht, ob das rechtwinklig ist"
07.007.8,E,Reassessing sufficiency of information,Reassessing sufficiency of information,ob ich genug Informationen habe
07.007.9,E,Considering missing angle,Considering missing angle,ob ich nicht noch einen Winkel bräuchte
07.007.10,E,Reviewing available givens,Reviewing available givens,Was habe ich denn da noch?
07.007.11,E,Restating problem question,Restating problem question,which for following could be the length of CP?
07.007.12,E,Reporting need for reading glasses,Reporting need for reading glasses,Ich brauche eine Lesebrille
07.007.13,E,Verbalizing intended query before typing,Verbalizing intended query before typing,"Wie viele Angaben brauche ich, um ein Dreieck zu bestimmen"
07.008.1,E,Querying LLM about triangle-determination requirements,Querying LLM about triangle-determination requirements,Wieviel Angaben brauche ich um ein Dreieck zu bestimmen
07.010.1,E,Validating own prior knowledge against response,Validating own prior knowledge against response,Das mit den drei Angaben habe ich schon mal richtig in Erinnerung gehabt
07.010.2,E,Concluding a given is missing,Concluding a given is missing,mir fehlt noch eine Angabe
07.012.1,E,Identifying given side,Identifying given side,Ich habe letztendlich die Seite gegeben
07.012.2,E,Matching givens to determinacy case,Matching givens to determinacy case,zwei Seiten und einen eingeschlossenen Winkel
07.012.3,E,Hypothesizing alternative sufficient condition,Hypothesizing alternative sufficient condition,"Wenn ich jetzt hier die gegenüberliegenden Winkel hätte, wäre es auch egal"
07.012.4,E,Concluding hypothetical determinacy,Concluding hypothetical determinacy,wäre die Sache eindeutig bestimmt
07.012.5,E,Describing degree of freedom in figure,Describing degree of freedom in figure,verschiebt sich dieses Teil hier lustig auf der Sache hin und her
07.012.6,E,Labeling point in drawing,Labeling point in drawing,Das ist ja hier der Punkt P
07.014.1,E,Explaining vision workaround strategy,Explaining vision workaround strategy,"die Brille abnehme, damit ich nicht das Sichtfenster der Gleitsichtbrille finden muss"
07.014.2,E,Adjusting physical position relative to screen,Adjusting physical position relative to screen,rück dem Laptop einfach ein bisschen auf die Pelle
07.014.3,E,Stating problem givens,Stating problem givens,x ist 32 und r ist 18
07.014.4,E,Restating problem goal,Restating problem goal,die Länge des Kreisbogens haben
07.014.5,E,Attributing request for formula to task,Attributing request for formula to task,er will jetzt die Formel von mir wissen
07.014.6,E,Deciding to attempt mental calculation first,Deciding to attempt mental calculation first,noch ein bisschen was im Kopf zu rechnen
07.014.7,E,Considering querying LLM as fallback,Considering querying LLM as fallback,könnte man die Sache jetzt hier fragen
07.014.8,E,Verbalizing intended query before typing,Verbalizing intended query before typing,Was ist die Formel für Kreisumfang?
07.015.1,E,Querying LLM for circle-circumference formula,Querying LLM for circle-circumference formula,Was ist die Formel für Kreisumfang
07.017.1,E,Confirming formula from response,Confirming formula from response,"Sehr schön, 2 Pi r"
07.017.2,E,Applying formula to compute circumference,Applying formula to compute circumference,damit habe ich den gesamten Umfang
07.017.3,E,Relating angle to full-circle degrees,Relating angle to full-circle degrees,das ganze 360 ist der Vollkreis und der Winkel ist letzten Endes 32
07.017.4,E,Self-verifying own claim,Self-verifying own claim,"ist das jetzt richtig, was ich da jetzt gerade behaupte?"
07.017.5,E,Correcting own calculation setup,Correcting own calculation setup,"32 durch 360, genau verkehrt rum"
07.017.6,E,Performing intermediate calculation,Performing intermediate calculation,das [radius 18] zwei mal [gleich] 36 durch [unverständlich]
07.017.7,E,Searching for calculator tool,Searching for calculator tool,irgendwo wird auch hier der Taschenrechner versteckt
07.017.8,E,Expressing reluctance to manually simplify fraction,Expressing reluctance to manually simplify fraction,"zu faul, um den Bruch 360 zu 32 richtig zu kürzen"
07.017.9,E,Performing calculation step,Performing calculation step,das ganze mal 2
07.017.10,E,Evaluating intermediate result,Evaluating intermediate result,Das sieht schon besser aus
07.017.11,E,Continuing calculation with given values,Continuing calculation with given values,"22,5 mal Pi und r war in dem Fall 18"
07.017.12,E,Searching for calculation error,Searching for calculation error,wo ist jetzt hier der Fehler?
07.017.13,E,Reporting calculator's computed result,Reporting calculator's computed result,Der behauptet jetzt 405
07.017.14,E,Deciding to redo calculation,Deciding to redo calculation,Machen wir das nochmal
07.017.15,E,Restating calculation,Restating calculation,Das sind 36 und 32 durch 360
07.017.16,E,Simplifying fraction,Simplifying fraction,Das ist 32/10
07.017.17,E,Simplifying fraction further,Simplifying fraction further,Oder aber 16/5
07.017.18,E,Restating given value from problem figure,Restating given value from problem figure,die in der Abbildung gezeichneten Linien hat eine Länge von 10
07.017.19,E,Restating point definitions,Restating point definitions,"M ist die Mitte der Linie A, B. N ist ein Punkt der Linie A, M"
07.017.20,E,Restating problem question,Restating problem question,Wie lange ist der Abschnitt in C?
07.017.21,E,Restating given point definition,Restating given point definition,"C ist die Mitte des Abschnittes M, B"
07.017.22,E,Deriving relation between segments,Deriving relation between segments,"M, C ein Viertel der ganzen Geschichte"
07.017.23,E,Stating computed segment value,Stating computed segment value,"K ist 2,5"
07.017.24,E,Computing final answer from attributed given value,Computing final answer from attributed given value,"da er behauptet, dass M, N, 1 ist, wäre die Lösung 3,5"
07.017.25,E,Signaling task completion,Signaling task completion,"Mache jetzt fertig, es hat mir zu duschen"
08.002.1,E,Restating problem parameters,Restating problem parameters,Kreis O hat einen Radius von 5 und die Länge der Linie AB ist 8
08.002.2,E,Restating problem question,Restating problem question,Wie groß ist die Distanz von der Mitte des Kreises O zur Linie AB?
08.002.3,E,Planning auxiliary construction,Planning auxiliary construction,da würde ich jetzt mir ein Dreieck einzeichnen
08.002.4,E,Clarifying note-taking protocol,Clarifying note-taking protocol,willst du die Notizen noch haben?
08.004.1,E,Constructing auxiliary triangle,Constructing auxiliary triangle,die Linien vom Mittelpunkt nach A und nach B ziehen
08.004.2,E,Identifying known triangle side lengths,Identifying known triangle side lengths,"die Linie AB, die die Länge 8 hat und die beiden Seiten, die die Länge 5 haben"
08.004.3,E,Reframing distance as triangle height,Reframing distance as triangle height,"die Distanz von der Mitte bis AB, quasi die Höhe"
08.004.4,E,Inferring perpendicularity from distance definition,Inferring perpendicularity from distance definition,muss ja diese Verbindung ... im Prinzip senkrecht drauf stehen
08.004.5,E,Concluding right angle,Concluding right angle,einen 90°-Winkel
08.004.6,E,Verifying right-angle assumption,Verifying right-angle assumption,"muss ich mal überlegen, ob das ... tatsächlich"
08.004.7,E,Deriving half-chord length,Deriving half-chord length,die Hälfte wäre dann hier Länge 4
08.004.8,E,Applying Pythagorean theorem,Applying Pythagorean theorem,der Satz des Pythagoras
08.004.9,E,Mapping values onto Pythagorean formula,Mapping values onto Pythagorean formula,"die eine Kante, sagen wir A, ist die 4"
08.004.10,E,Setting up equation for unknown,Setting up equation for unknown,16 plus X^2 gleich 25
08.004.11,E,Solving for unknown and entering answer,Solving for unknown and entering answer,die Wurzel da draus ist dann 3
08.004.12,E,Inquiring about answer feedback,Inquiring about answer feedback,Kriegt mal gar keiner richtig oder falsch antwort?
08.008.3,E,Reading task statement,Reading task statement,Wir sehen ein Dreieck. Figure not drawn to scale
08.008.4,E,Restating problem question,Restating problem question,Which of the following could be the length of CP?
08.008.5,E,Noting task language mismatch,Noting task language mismatch,ich habe es natürlich auf Englisch gehört
08.008.6,E,Planning to visualize problem,Planning to visualize problem,das jetzt erst einmal visualisieren
08.008.7,E,Sketching triangle,Sketching triangle,unser Dreieck ABC
08.008.8,E,Placing point P on segment AB,Placing point P on segment AB,liegt irgendwo auf A und B ein Punkt P
08.008.9,E,Identifying perpendicularity condition,Identifying perpendicularity condition,"der liegt so, dass der senkrecht ist"
08.008.10,E,Reaffirming perpendicularity condition,Reaffirming perpendicularity condition,Das soll senkrecht sein
08.008.11,E,Sketching diagram,Sketching diagram,ich mal mir das mal kurz auf
08.008.12,E,Noting given side lengths,Noting given side lengths,AC ist 6 und BC ist 3
08.008.13,E,Identifying missing information,Identifying missing information,Über AB haben wir keine Angaben
08.008.14,E,Identifying sub-triangle with unknown side,Identifying sub-triangle with unknown side,"ein zweites Dreieck haben, dessen Länge wir suchen"
08.008.15,E,Restating target unknown,Restating target unknown,"die Seitenkante, die wir suchen"
08.008.16,E,Deciding to consult chatbot,Deciding to consult chatbot,diese Aufgabe mal dem Chatbot geben
08.008.17,E,Noting image upload option,Noting image upload option,konnten wir jetzt das Bild da einfügen
08.008.19,E,Copying task text into chat,Copying task text into chat,kopiere mir hier den Text von der Aufgabe
08.010.2,E,Expressing impasse/lack of ideas,Expressing impasse/lack of ideas,ich habe glaube ich nicht mehr viele Ideen
08.011.1,E,Submitting task query to chatbot,Submitting task query to chatbot,Wie lang ist die Linie CP?
08.015.1,E,Discovering CoT expansion feature,Discovering CoT expansion feature,das suchte ich gerade
08.015.2,E,Reading chatbot's CoT aloud,Reading chatbot's CoT aloud,"Das ist ein Problem, wenn dem Dreieck ABC gegeben ist"
08.015.3,E,Recognizing restated task in reasoning,Recognizing restated task in reasoning,das ist die Aufgabe
08.015.4,E,Reading chatbot's stated assumption,Reading chatbot's stated assumption,es handelt sich um ein rechtwinkliges Dreieck mit CP als Höhe
08.015.5,E,Challenging chatbot's assumption,Challenging chatbot's assumption,das Dreieck selber ist nicht rechtwinklig
08.015.6,E,Clarifying correct right-angle location,Clarifying correct right-angle location,den rechten Winkel zwischen ... der eingezeichneten Linie und der Kante
08.015.7,E,Confirming CP as height/altitude,Confirming CP as height/altitude,CP als Höhe
08.015.8,E,Judging chatbot's statement as incorrect,Judging chatbot's statement as incorrect,die Aussage ... ist schon mal falsch
08.015.9,E,Reading chatbot's restated givens,Reading chatbot's restated givens,Die Längen AC und BC sind gegeben
08.015.10,E,Reading chatbot's suggested next step,Reading chatbot's suggested next step,der Satz des Pythagoras oder ähnliche Dreiecke verwendet werden
08.015.11,E,Reading chatbot's suggested sub-step,Reading chatbot's suggested sub-step,"die Länge von AB berechnen, um dann die Höhe CP zu finden"
08.015.12,E,Reading chatbot's response prompt,Reading chatbot's response prompt,Könntest du zunächst die Länge von AB berechnen
08.015.13,E,Re-checking original task statement,Re-checking original task statement,schauen wir nochmal genau in die Aufgabe
08.015.14,E,Re-reading given values,Re-reading given values,AC gleich 6 und BC gleich 3
08.015.15,E,Re-reading task constraints,Re-reading task constraints,deren Länge wir nicht kennen
08.015.16,E,Re-reading target question,Re-reading target question,Wie lang ist die Linie CP?
08.015.17,E,Deciding to correct chatbot's assumption,Deciding to correct chatbot's assumption,seine Annahme ... ist falsch
08.015.18,E,Specifying correct right-angle location,Specifying correct right-angle location,"das wäre APC, hat einen rechten Winkel"
08.015.19,E,Specifying angle vertex,Specifying angle vertex,Winkel bei P
08.015.20,E,Testing whether chatbot accepts correction,Testing whether chatbot accepts correction,ob der Chatbot sich korrigieren lässt
08.016.1,E,Correcting chatbot's assumption in message,Correcting chatbot's assumption in message,Deine Annahme ... ist falsch
08.018.1,E,Reading chatbot's follow-up question,Reading chatbot's follow-up question,Wie würdest du die Länge von AB ausdrücken?
08.018.2,E,Reading chatbot's hint,Reading chatbot's hint,"denke daran, dass P zwischen A und B liegt"
08.018.3,E,Planning to apply Pythagorean theorem,Planning to apply Pythagorean theorem,nach Pythagoras das ganze Ding aufstellen
08.018.4,E,Assigning variable to unknown height,Assigning variable to unknown height,die gesuchte Höhe ist jetzt X
08.018.5,E,Assigning variables to segment lengths,Assigning variables to segment lengths,von A nach P nehmen wir dann a und von P nach B nehmen wir b
08.018.6,E,Confirming variable assignment,Confirming variable assignment,AP ist a und PB ist b
08.018.7,E,Noting right angle at P,Noting right angle at P,bei P einen rechten Winkel
08.018.8,E,Setting up Pythagorean equation for triangle APC,Setting up Pythagorean equation for triangle APC,"wir kennen die Länge AC, das ist 6"
08.018.9,E,Completing equation with unknowns,Completing equation with unknowns,X dann zu Quadrat plus entsprechend a^2
08.018.10,E,Setting up equation for second triangle,Setting up equation for second triangle,den rechten Winkel haben bei dem anderen Dreieck PBC
08.018.11,E,Writing second Pythagorean equation,Writing second Pythagorean equation,3^2 gleich X^2 plus b^2
08.018.12,E,Evaluating usefulness of rearranging equations,Evaluating usefulness of rearranging equations,ob einem das irgendetwas bringt
08.018.13,E,Considering eliminating shared term,Considering eliminating shared term,das X^2 rausrechnen
08.018.14,E,Expressing uncertainty about approach's usefulness,Expressing uncertainty about approach's usefulness,ob ... das allzu viel bringt
08.018.15,E,Attempting to follow chatbot's suggested approach,Attempting to follow chatbot's suggested approach,so wie der Chatbot das ja hier vorschlägt
08.018.16,E,Seeking expression relating a and b,Seeking expression relating a and b,einen Ausdruck für diese Aufteilung zwischen a und b
08.018.17,E,Solving equations for x,Solving equations for x,36 minus a^2 gleich ... 9 minus b^2
08.018.18,E,Rearranging equation algebraically,Rearranging equation algebraically,27 minus a^2 gleich minus b^2
08.018.19,E,Continuing algebraic rearrangement,Continuing algebraic rearrangement,27 gleich a^2 minus b^2
08.018.20,E,Expressing uncertainty about derived formula,Expressing uncertainty about derived formula,bin ich mir jetzt gerade gar nicht mehr sicher
08.018.21,E,Re-reading chatbot's question,Re-reading chatbot's question,wie würde es die Länge ... ausdrücken?
08.018.22,E,Re-reading chatbot's hint,Re-reading chatbot's hint,Denke daran das P zwischen A und B
08.018.23,E,Recognizing own reasoning dead-end,Recognizing own reasoning dead-end,ich habe mich gerade komplett verrannt
08.018.24,E,Reassessing available information,Reassessing available information,hilft uns das etwas weiter
08.018.25,E,Expressing inability to find solution path,Expressing inability to find solution path,"Ich sehe definitiv gerade nicht, wie ich da auf eine Länge komme"
08.018.26,E,Reviewing known base segments,Reviewing known base segments,die beiden Grundseiten
08.018.27,E,Re-reading chatbot's question while composing reply,Re-reading chatbot's question while composing reply,Wie würdest du die Länge von a und a ausdrücken?
08.018.28,E,Identifying too many unknowns,Identifying too many unknowns,zu viele Unbekannte
08.018.29,E,Deciding to explain own work to chatbot,Deciding to explain own work to chatbot,was ich jetzt hier gerade gemacht habe
08.018.30,E,Composing explanation of triangle division,Composing explanation of triangle division,teilt das bestehende Dreieck ABC in zwei neue Dreiecke
08.018.31,E,Composing explanation of right angles,Composing explanation of right angles,"der Winkel, bei P jeweils rechtwinkelig ist"
08.018.32,E,Composing explanation of Pythagorean application,Composing explanation of Pythagorean application,den Satz von Pythagoras anwenden
08.018.33,E,Composing variable definitions,Composing variable definitions,AP = a und die Kante PB = b
08.018.34,E,Composing variable definition for target,Composing variable definition for target,PC = X
08.018.35,E,Announcing derived formulas,Announcing derived formulas,ergeben sich 2 Formeln
08.018.36,E,Asking how to notate exponent,Asking how to notate exponent,es wäre hoch einfach mit dem?
